,author_id,verified_purchase,review_title,reviews,country,date,reviewer_name,ratings,people_find_helpful,start_time,end_time,product_name,average_rating,price,total_reviews,product_category,product_id,meta_data,rank,product_image_url
0,R99PXQX4LEG7Q,True,Täglicher Begleiter.,"+ heller Lichtkegel mit zusätzlichem Spot in der Mitte, typisch für taktische Lampen
+ sehr kompaktes Design, passt Problemlos in jede Hosentasche
+ einfache Bedienung mit hörbarem und fühlbarem clicky-button
+ Rollschutz
+ abnehmbarer Clip
+ Lanyard mit Nitecore-Schriftzug, der sich ums Handgelenk verengen und zuziehen lässt, was eine einhändige Bedienung und ein Fallenlassen aus der Hand ermöglicht, ohne dass die Lampe auf den Boden fällt
+ Stroboskop mit einem kurzen Drehen direkt erreichbar (wenn vorher eingestellt)

+-: Preis - Nicht wenig für eine solch kleine Taschenlampe, meiner Meinung nach jedoch absolut gerechtfertigt.

Neutral: Die kompakte Größe bedingt, dass CR123 Batterien verwendet werden müssen. Diese sind deutlich kürzer als AAA oder AA Batterien. Wie bei vielen Taschenlampen bieten sich hier jedoch auch Akkus an.",germany,"September 4, 2016",Everyday Stuff,5.0,0,2020-11-12 15:06:50.612235,2020-11-12 15:06:50.761518,"NiteCore CREE XP-G R5 MT1C Multitask LED Flashlight, Black",4.2,53.99,,Tools & Home Improvement,B00937YE6C,"{'product dimensions': '8.79 x 2.34 x 2.34 cm; 18.14 Grams', 'batteries': '1 CR123A batteries required.', 'item model number': 'NiteCore-MT1C', 'is discontinued by manufacturer': 'No', 'color': 'Black', 'hand orientation': 'Left/Right', 'height': '2 inches', 'length': '1 inches', 'weight': '91 Grams', 'width': '2 inches', 'bulb type': 'LED', 'material': 'Aluminum alloy', 'batteries included?': 'No', 'brand': 'Nitecore', 'item weight': '18.1 g'}","#475,813 in Tools & Home Improvement (See Top 100 in Tools & Home Improvement)
#4,109 in Handheld Flashlights",https://images-na.ssl-images-amazon.com/images/I/41rCVrGpjBL._AC_SX425_.jpg
1,R1C0WODJNM4OD7,True,Gute Lampe zum Mitführen,"Anstatt der auf Amazon noch beworbenen alten Ausführung der Lampe mit 280 Lumen wurde das überarbeitete Modell mit 345 Lumen geliefert.
Die Lampe ist klein, handlich und leicht, weshalb man sie immer in der Hosentasche tragen kann, ein Clip und eine Handschlinge werden mitgeliefert und können bei Bedarf an der Lampe angebracht werden.
Für diese Größe weist sie eine außerordentliche Lichtleistung auf und genügt dem Durchschnittsnutzer und nicht Flashaholic absolut im alltäglichen Gebrauch zuhause oder auch draußen.
Der einzige Wermutstropfen an der Lampe sind die voreingestellten Modi. Da es in der Beschreibung heißt, man könne ""individuelle Einstellungen"" vornehmen, dachte ich, die Modi wären programmierbar. Allerdings ist unter dieser Angabe wohl nur zu verstehen, dass die Lampe den zuletzt genutzten Modus speichert. Es stehen ein SOS-Modus, ein Stroboskop, drei verschiedene Leuchtstärken und der Turbo-Modus mit voller Lichtleistung zur Verfügung. In den letzteren kann man aus jedem Modus durch Drehen des Lampenschaftes schalten, die anderen muss man, da sie voreingestellt und nicht löschbar sind, hintereinander durchschalten, wenn man eine bestimmte Leuchtstärke möchte, was ab und an etwas umständlich, aber verschmerzbar ist. Die voreingestellten Leuchtstärken sind gut abgestuft/ausgewählt.

Insgesamt für diese Größe und diesen Preis eine sehr gute Lampe, die ich weiterempfehlen würde.",germany,"September 6, 2015",Maximilian,5.0,0,2020-11-12 15:06:50.766156,2020-11-12 15:06:50.928506,"NiteCore CREE XP-G R5 MT1C Multitask LED Flashlight, Black",4.2,53.99,,Tools & Home Improvement,B00937YE6C,,"#475,813 in Tools & Home Improvement (See Top 100 in Tools & Home Improvement)
#4,109 in Handheld Flashlights",https://images-na.ssl-images-amazon.com/images/I/41rCVrGpjBL._AC_SX425_.jpg
2,R2PT8K3XXOTKMG,True,il solito buon prodotto Nitecore,"E' un'ottima torcia tascabile, di dimensioni piccole, ma non tali da renderne difficile il maneggio e/o la gestione. Come gi àscritto per altre torce Nitecore il prodotto è validissimo, l'unica pecca è nella poca definizione tra la separazione dei due fasci di luce, quello centrale più forte e definito e quello laterale più diffuso e ampio. Per il resto la solita buona qualità Nitecore abbinata ad un buon prezzo.",italy,"October 14, 2014",MacBaren,4.0,0,2020-11-12 15:06:50.933749,2020-11-12 15:06:51.086593,"NiteCore CREE XP-G R5 MT1C Multitask LED Flashlight, Black",4.2,53.99,,Tools & Home Improvement,B00937YE6C,,"#475,813 in Tools & Home Improvement (See Top 100 in Tools & Home Improvement)
#4,109 in Handheld Flashlights",https://images-na.ssl-images-amazon.com/images/I/41rCVrGpjBL._AC_SX425_.jpg
3,R159ADEWOB7FAU,True,prodotto come da descrizzione,"materiali molto buoni ,portabilità eccellente per chi a necessità per lavoro di un torcia compatta ma potente
unica pecca la regolazione delle varie funzioni in pratica non è molto intuitiva in confronto ad una fenix in mio possesso.-
in generale da comprare.-",italy,"December 11, 2014",jano,4.0,0,2020-11-12 15:06:51.091842,2020-11-12 15:06:51.240122,"NiteCore CREE XP-G R5 MT1C Multitask LED Flashlight, Black",4.2,53.99,,Tools & Home Improvement,B00937YE6C,,"#475,813 in Tools & Home Improvement (See Top 100 in Tools & Home Improvement)
#4,109 in Handheld Flashlights",https://images-na.ssl-images-amazon.com/images/I/41rCVrGpjBL._AC_SX425_.jpg
4,R35BWSW3TVI13I,True,con nigtcore non sbagli,ottimo articolo gia avute altre torcie tascabili di questa azienda e vai sicuro che se scegli torcie nigtcore non sbagli,italy,"October 7, 2015",alessandro buffoli,5.0,0,2020-11-12 15:06:51.245623,2020-11-12 15:06:51.394984,"NiteCore CREE XP-G R5 MT1C Multitask LED Flashlight, Black",4.2,53.99,,Tools & Home Improvement,B00937YE6C,,"#475,813 in Tools & Home Improvement (See Top 100 in Tools & Home Improvement)
#4,109 in Handheld Flashlights",https://images-na.ssl-images-amazon.com/images/I/41rCVrGpjBL._AC_SX425_.jpg
5,RZYB6FSKFY6ZS,True,"Attention, la pile n'est pas comprise!","Pas de pile dans le paquet; l'information fournie est peu explicite a ce sujet, un peu décevant.
Sinon, le produit semble OK",france,"September 9, 2014",Sunbird,2.0,0,2020-11-12 15:06:51.401018,2020-11-12 15:06:51.545448,"NiteCore CREE XP-G R5 MT1C Multitask LED Flashlight, Black",4.2,53.99,,Tools & Home Improvement,B00937YE6C,,"#475,813 in Tools & Home Improvement (See Top 100 in Tools & Home Improvement)
#4,109 in Handheld Flashlights",https://images-na.ssl-images-amazon.com/images/I/41rCVrGpjBL._AC_SX425_.jpg
6,R3BII0O6MNW1F7,True,Bella e piccola,Ottimo prodotto piccolo leggero e maneggevole! Metto solo 4 stelle e non 5 per i seguenti motivi! La torcia in se è più che adeguata se non superiore a certi concorrenti però l'utilizzo tra la modalità turbo e le altre quattro risulta difficoltosa e anche la selezione dei livelli non sempre risulta immediata! Però poi prendendoci la mano si riesce a farla lavorare abbastanza bene! La mia è arrivata con l'upgrade a 345 lumens invece di 280! confrontando la con la fenix PD22 a 190 lumens non si nota grande differenza. Forse bisognerebbe provarla con una natura rlcr123a a 3.7v. Ma non essendo specificato sulle istruzioni (in Inglese) ho lasciato perdere. Nella confezione sono assenti la batteria e una custodia che avrebbero fatto comodo! Nel complesso è una buona torcia!,italy,"November 22, 2014",ILPalmeR1972,4.0,0,2020-11-12 15:06:51.553105,2020-11-12 15:06:51.701659,"NiteCore CREE XP-G R5 MT1C Multitask LED Flashlight, Black",4.2,53.99,,Tools & Home Improvement,B00937YE6C,,"#475,813 in Tools & Home Improvement (See Top 100 in Tools & Home Improvement)
#4,109 in Handheld Flashlights",https://images-na.ssl-images-amazon.com/images/I/41rCVrGpjBL._AC_SX425_.jpg
7,R3SCT76JHCQ0G8,True,ナイトコア６本目。,"ヘッドを回してプリセットを呼び出すのがお気に入りでこのメカニズムのシリーズの電池が違う型を買い揃えてしまいました。
小さいので旅行等に持っていっても邪魔にならないのが良いです。反面、小さいのが災いして握り込むと少々手応えが頼りないのが弱点ですね。
このライトはロックアウトしてカメラバッグに常備することにします。",japan,"August 12, 2018",消費者,5.0,0,2020-11-12 15:06:51.706906,2020-11-12 15:06:51.876240,"NiteCore CREE XP-G R5 MT1C Multitask LED Flashlight, Black",4.2,53.99,,Tools & Home Improvement,B00937YE6C,,"#475,813 in Tools & Home Improvement (See Top 100 in Tools & Home Improvement)
#4,109 in Handheld Flashlights",https://images-na.ssl-images-amazon.com/images/I/41rCVrGpjBL._AC_SX425_.jpg
8,R1DRG1RTR21PH4,True,持ち運びはいい。一部気になる点あり。,"明るさは掲載されている通りの明るさで、満足。配光は広め。境目はわからないほど。不自然なムラはなし、周辺にもムダな光はなし。ややスイッチが押しにくい。というのも
スイッチの誤押しを防ぐものが、ライト自体が細いために若干指に当たる。
ポケットにいれたり普段持ち歩くには、十分な大きさ、軽い重さである。
他のレビューである通り、モード切り替えの2秒は気になる。そのためこの製品は、ターボモード中心で使う人に合うだろう。",japan,"February 15, 2014",takuto,4.0,0,2020-11-12 15:06:51.881828,2020-11-12 15:06:52.028767,"NiteCore CREE XP-G R5 MT1C Multitask LED Flashlight, Black",4.2,53.99,,Tools & Home Improvement,B00937YE6C,,"#475,813 in Tools & Home Improvement (See Top 100 in Tools & Home Improvement)
#4,109 in Handheld Flashlights",https://images-na.ssl-images-amazon.com/images/I/41rCVrGpjBL._AC_SX425_.jpg
9,R36BBZHMQ5YHTC,True,小型かつ十分な照度,"手のひらサイズの小型フラッシュライト

必要かつ十分な光量がある
モード設定もついておりシーンに合わせて
使い分けられる

ライト全体が短いため握ったままのテールスイッチ
の操作がしづらい、また購入時バッテリーを入れる際
きついのでナイトコアのシリコングリース塗りつけると
解決するのでおすすめです。",japan,"March 9, 2014",しょーごー,4.0,0,2020-11-12 15:06:52.034092,2020-11-12 15:06:52.178068,"NiteCore CREE XP-G R5 MT1C Multitask LED Flashlight, Black",4.2,53.99,,Tools & Home Improvement,B00937YE6C,,"#475,813 in Tools & Home Improvement (See Top 100 in Tools & Home Improvement)
#4,109 in Handheld Flashlights",https://images-na.ssl-images-amazon.com/images/I/41rCVrGpjBL._AC_SX425_.jpg
10,R2D7VAT60TOU2T,True,CR123Aを使うタクティカルライトではベストな製品の一つかも,"CR123Aは単価が高いけれども、未使用時の寿命が長めなので防災備品としては
これを利用するライトは重要だと思っています。
本製品はCR123Aを1本使うフラッシュライトとしてはFENIXのPDなどと並んで
質感もよく、安心・安定感のある製品だと思います。",japan,"November 1, 2015",たたた,4.0,0,2020-11-12 15:06:55.335781,2020-11-12 15:06:55.546216,"NiteCore CREE XP-G R5 MT1C Multitask LED Flashlight, Black",4.2,53.99,,Tools & Home Improvement,B00937YE6C,,"#475,813 in Tools & Home Improvement (See Top 100 in Tools & Home Improvement)
#4,109 in Handheld Flashlights",https://images-na.ssl-images-amazon.com/images/I/41rCVrGpjBL._AC_SX425_.jpg
11,R3SQ122ZVB20WH,True,ものすごい威力,扱いやすく、すごく遠くまで照らせます。キッチンシンクの奥の配線をもぐってみるのに最適でした,japan,"October 11, 2017",パリパリ,5.0,0,2020-11-12 15:06:55.551519,2020-11-12 15:06:55.696786,"NiteCore CREE XP-G R5 MT1C Multitask LED Flashlight, Black",4.2,53.99,,Tools & Home Improvement,B00937YE6C,,"#475,813 in Tools & Home Improvement (See Top 100 in Tools & Home Improvement)
#4,109 in Handheld Flashlights",https://images-na.ssl-images-amazon.com/images/I/41rCVrGpjBL._AC_SX425_.jpg
12,R2QXLEIDE8S5NE,True,frustracion,"Vender una linterna sin sus pilas es frustrante para quien la compra.
En la información de compra no se especifica que viene sin ellas.",spain,"May 17, 2015",Francisco Javier Fernandez,3.0,0,2020-11-12 15:06:55.702555,2020-11-12 15:06:55.851541,"NiteCore CREE XP-G R5 MT1C Multitask LED Flashlight, Black",4.2,53.99,,Tools & Home Improvement,B00937YE6C,,"#475,813 in Tools & Home Improvement (See Top 100 in Tools & Home Improvement)
#4,109 in Handheld Flashlights",https://images-na.ssl-images-amazon.com/images/I/41rCVrGpjBL._AC_SX425_.jpg
13,R96Z3F6SJHF0V,True,"Klein,Hell,Sparsam","Gerade jetzt in der dunklen Zeit wenn ich mit meinen kleinen Hunde eine Runde gehe ist die
NITECORE MT1C optimal.
Rein in die Schlaufe so verliere ich die Taschenlampe nicht.
Den Weg ausleuchten , wau fast ein halber Kilometer.
Wahnsinn was dieses kleiner Ding leistet.
Voller Power braucht man nicht,die kleinste Einstellung reicht.
So spart man auch Energie.",germany,"December 11, 2013",Frank,5.0,0,2020-11-12 15:06:55.857480,2020-11-12 15:06:56.018791,"NiteCore CREE XP-G R5 MT1C Multitask LED Flashlight, Black",4.2,53.99,,Tools & Home Improvement,B00937YE6C,,"#475,813 in Tools & Home Improvement (See Top 100 in Tools & Home Improvement)
#4,109 in Handheld Flashlights",https://images-na.ssl-images-amazon.com/images/I/41rCVrGpjBL._AC_SX425_.jpg
14,R2N0GNQKBY3EFR,True,手のひらすっぽり、小型ながらも明るい！,"カバンに常時持ち歩ける程度のライトを探していました。
今回、ライトを選ぶ基準としては以下のとおりで、

１．電池の種類→ＣＲ１２３Ａ使用。３Ｖ電源と予備電池の携帯性（価格はともかく）
２．形状→レンズ側先端部分がクラウン型になっている。（レンズ保護のや消灯忘れ防止のため）
３．携帯性のよさ。（あまり太くなく、邪魔にならない長さで、非常時・災害時にもとりあえず取り出せるぐらいの手軽さと丈夫さ。）

で探してました。
ネットでいろんなメーカーのカタログを見て回って、今回のＭＴ１Ｃにたどり着きました。
ＮＩＴＥＣＯＲＥの「ＭＴ１Ｃ」（ＣＲ１２３Ａを１本使用）と「ＭＴ２Ｃ］（ＣＲ１２３Ａを2本使用）で
ずいぶん迷ってこちら側にしてみました。

実物を見て思ったのは「考えてたよりずーっと小さく感じる」でした。
私は手が大きいほうで、グローブだとＬＬ〜３Ｌぐらいをいつも使っていますが、
指先方向に対して横に向けて握るとほぼすっぽり手に収まるサイズです。
（自宅で比較できるもの探したら、コクヨのスティックのりＰｒｉｔｔと同じ長さでやや細身）

最初、ＭＴ２Ｃのほうがよかったかなー？と思いましたが、使ってみて約1ヶ月。
使い勝手のよさについてはこちらのほうで正解だったと思っています。

ライトとしての性質はやや指向性が高いというか、あまり拡散せず集光度が高いです。
電池が３Ｖということもあり、明るさも十分。日常的な使用や夜の散歩など程度では問題ないです。

「ターボモード」「ユーザディファインモード（5種類）」と点灯方法が選択できて、用途に合わせて
切り替えられるというのも便利です。
自宅内で机の下での配線作業などではＬｏｗモードで十分。頑張れば口で咥えて
両手が使えます。（金属くさいですがｗ）
また、自動車の整備などでも使えて、汚れても防水性能もあるので軽く洗えたりします。

また、点灯したまま床に置くとき、レンズ面を下にして立てておいても、クラウン形状なので
床面に光が漏れるので、暗い場所でライトを探したり、消し忘れたり防止にもなります。
タクティカルユースならガラスを割ったり色々用途はあるのでしょうが、これについては
突起は低いのでそこまで求めるのはちょっと違うのでしょうね。

日常的に、こまめに使う用途なら必要十分な機能です。
しかしながら、性能のせいか色々と気になることもあります。

まずは発熱。けっこう熱くなります。
手のひらサイズということもあり、連続点灯すると逆手で持ったりすると手の平が焼けそうになります。
なので、時々消灯して冷まして使ったりしてます。
そういった意味でも長めのＭＴ２Ｃのほうが良かったかなー？と思ったりもしましたが
ライトに発熱は付き物だと割り切りました。

あとは、「ユーザディファインモード」について。
色々と点灯方法を選べて便利なのですが、それ故の代償というか。
本体のボタンは一つなのですが、点灯状態でライトの先端部を少し緩めた状態で「ユーザディファインモード」、
完全に締めた状態で「ターボモード」になるのですが、「ユーザーディファインモード」については、ボタンを
オン・オフを2秒以内にするとＨｉ→Ｍｉｄ→Ｌｏｗ→ＳＯＳ→点滅（結構早い点滅）と切り替わります。
2秒以上そのモードを使うと「選択」した状態になり、再度点灯したときにはそのモードで点灯します。
そのため、ほんのちょっとした用事で一瞬スイッチを押して切ってしまったり、押しそこなってあわてて連打してしまうと
モードが切り替わってしまって、次に再点灯したときに明るさが変わっていたり・・ということはあります。

ただ、「ターボモード」時（締めこんだ状態）では「ユーザーディファインモード」の切り替え機能が行われていない（無効になっている）
ので、消灯の度に一度「ターボモード」（閉めこむ）にしてから電源を切ると、無用な切り替えを防げます。

まぁ、最初は気になるところもありましたすが、使用目的としては十分ですので今としては気に入って使っています。
先日、実家で停電があったときに使用する機会がありましたて、うちの親父が惚れ込んでしまって
災害時使用目的でただ今購入を検討している模様。

ごく一般的なライトに比べるとややお高いですが、機能は十分。良い物です。",japan,"July 25, 2013",ゆーじん,5.0,0,2020-11-12 15:06:56.025155,2020-11-12 15:06:56.178180,"NiteCore CREE XP-G R5 MT1C Multitask LED Flashlight, Black",4.2,53.99,,Tools & Home Improvement,B00937YE6C,,"#475,813 in Tools & Home Improvement (See Top 100 in Tools & Home Improvement)
#4,109 in Handheld Flashlights",https://images-na.ssl-images-amazon.com/images/I/41rCVrGpjBL._AC_SX425_.jpg
15,R31Y6FJV4HAOZQ,True,EDC (Every-day-carry)にちょうどいい大きさ,"先日購入したMaglite xl200に続き2本目のLEDフラッシュライトになります。
xl200は非常に使いやすいライトですが、毎日持ち歩くには少し大きいため
より携帯に適した小型ライトとしてこちらのMT1Cを購入しました。

まず大きな特徴として、ヘッド部を閉め込むか、緩めるかでTurboモードと
User definedモードを切り替えることができます。
ヘッドを締めこんでTurboモードの状態で本体後部のテールスイッチを押すと
最大出力280ルーメンで光を照射します。この際、スイッチをカチッと
音がするまで押し込むと連続点灯ができます。

次にヘッドを少し緩めてUser definedモードにし、半押しを繰り返すと、Hi-Mid-Low-SOS-ストロボの順でモード
が切り替わります。そして目的の明るさのところでスイッチを完全に押し込むと
そのモードで連続点灯します。ここでスイッチを切るとメモリー機能により次回点灯時
には最後に使ったモードで点灯します。ただ注意が必要でメモリー機能を使うためには
スイッチを切ってから2秒以上待って再びスイッチを入れる必要があります。

付属品として鉄製のクリップ、予備のテールキャップとOリング、ストラップが付属します。
クリップはヘッド、テール両方の向きにつけることができて便利です。
クリップなしでも机の上をコロコロ転がらないように加工されているなど気がききます。
毎日持ち歩いて護身用などとして使う際、ヘッドを締め込んでスイッチを
Onするだけで最大輝度を出してくれるTurboモードは大変心強いものです。

不満点があるとすればメモリー機能を使うために2秒間待つ必要があるところです。
明るさを固定した状態で頻繁にスイッチをOn/Offする際には、不意にモードが切り替わって
しまい、少し不便です。なお本体には電池が付属していませんのでご注意ください。",japan,"December 16, 2012",どっぴぃ,4.0,0,2020-11-12 15:06:56.184512,2020-11-12 15:06:56.322833,"NiteCore CREE XP-G R5 MT1C Multitask LED Flashlight, Black",4.2,53.99,,Tools & Home Improvement,B00937YE6C,,"#475,813 in Tools & Home Improvement (See Top 100 in Tools & Home Improvement)
#4,109 in Handheld Flashlights",https://images-na.ssl-images-amazon.com/images/I/41rCVrGpjBL._AC_SX425_.jpg
16,R1BQGIHNJ2CLWL,True,デザインとコストパフォーマンスが最高,"この値段で、このスペックなら、申し分はありません。

ターボモード→ユーザーディファインモードの切り替えは、ヘッドを締めれば良いだけなので、さほど苦になりません。
ただ、他の方が言われてますが、ユーザディファインモードでのモードの切り替えが不便なのが難点ですが、なれれば問題ないでしょう。
大きさも手頃で、携帯に便利。このサイズで、これだけの光量が出るのは、すばらしい。
常に持ち歩ける懐中電灯としては、これがベストです。

ただ、一番自分が気に入ってるのはデザインです。

さんざん、いろんなメーカーを選んで、この無骨なデザインが、何よりも気に入りました。
デザインだけで、星５を上げたいほどです。

露骨なほどの無骨さを感じさせるデザインは、日本のメーカーでは、なかなか見かけないので（そもそもタクティカルライトの日本のメーカーがほとんど無いというのもありますが）携帯してるだけで楽しくなります。

どうせ常に携帯するなら、デザインとして納得できる物。

ＭＴ１Ｃは、スペック、デザインともに心から満足できる一品です。",japan,"April 29, 2013",nekoame,5.0,0,2020-11-12 15:06:56.327823,2020-11-12 15:06:56.473925,"NiteCore CREE XP-G R5 MT1C Multitask LED Flashlight, Black",4.2,53.99,,Tools & Home Improvement,B00937YE6C,,"#475,813 in Tools & Home Improvement (See Top 100 in Tools & Home Improvement)
#4,109 in Handheld Flashlights",https://images-na.ssl-images-amazon.com/images/I/41rCVrGpjBL._AC_SX425_.jpg
17,R1IOTLVIN1QJ4I,True,すばらしい！,"今までこのてのライトを各種入手してきましたが（キセノンバルブ時代のSUREFIRE Z2 コンバットからホームセンターの安価なもの等）、サイズは単三使用の日動「スーパーLEDライト SL-3W-SLIM」よりも細く、明るさは CR123Ax２本使用の「SUREFIRE Z2 コンバット キセノンバルブ仕様」よりはるかに明るいです。
デザイン、質感共に満足いく仕上げです。SUREFIREにも見劣りしません。
５つ星つけたいところですが、対応が遅く、同じ日にオーダーした別の品は２〜３日で届きましたが、こちらは１週間かかりました。
ただ商品自体はお薦めです。",japan,"November 6, 2013",monroe walk,4.0,0,2020-11-12 15:06:56.480413,2020-11-12 15:06:56.631331,"NiteCore CREE XP-G R5 MT1C Multitask LED Flashlight, Black",4.2,53.99,,Tools & Home Improvement,B00937YE6C,,"#475,813 in Tools & Home Improvement (See Top 100 in Tools & Home Improvement)
#4,109 in Handheld Flashlights",https://images-na.ssl-images-amazon.com/images/I/41rCVrGpjBL._AC_SX425_.jpg
18,R39MCLA92WB1M,True,値段の割に高性能...,"叔父に頼まれて、買いました。
その叔父が使う用途としては、昼間に車のエンジン内部を見るのに使っているそうです。
実際に使っていて使い勝手がよいそうです（昼間でも明るいそうです）
そして、値段も良い、重くもないとの事です
自分は、jetBeam PC10 EDC TACTICALを使っています、それと比べましたがこちらのFLASHLIGHTも十分に対抗できます

あと肝心なのは、「どの用途で使うか？」と言う事が大切だと思います。
ちなみに、surefire cr123を使っています
購入をお考えの方、よくご検討を...
以上",japan,"July 10, 2013",ggy19w,5.0,0,2020-11-12 15:06:56.636467,2020-11-12 15:06:56.793868,"NiteCore CREE XP-G R5 MT1C Multitask LED Flashlight, Black",4.2,53.99,,Tools & Home Improvement,B00937YE6C,,"#475,813 in Tools & Home Improvement (See Top 100 in Tools & Home Improvement)
#4,109 in Handheld Flashlights",https://images-na.ssl-images-amazon.com/images/I/41rCVrGpjBL._AC_SX425_.jpg
