,author_id,verified_purchase,review_title,reviews,country,date,reviewer_name,ratings,people_find_helpful,start_time,end_time,product_name,average_rating,price,total_reviews,product_category,product_id,meta_data,rank,product_image_url
0,R3K4C7KV7TDFTH,True,This is an excellent light delivering lots of power,this light is excellent. I use it daily for my work and it is always with me...for such a small light it is a very effective and powerful. I like the rechargeable feature ...I top it off about once a week with daily use. I was surprised that the case did not match the quality of this great light. I ordered a much better third party case from Amazon...but the light..It is my third Fenix purchase...never disappointed and very impressed with their products.,canada,"June 1, 2020",Robert Powell,5.0,0,2020-11-12 11:16:33.802833,2020-11-12 11:16:33.930491,Fenix PD36R 1600 Lumen USB rechargeable CREE LED tactical Flashlight with EdisonBright charging cable carry case bundle,4.8,144.95,,Tools & Home Improvement,B07TJ41TMC,"{'manufacturer': 'Fenix', 'parcel dimensions': '23.11 x 8.64 x 3.3 cm; 272 Grams', 'batteries': '1 Lithium ion batteries required. (included)', 'material': 'Aluminum', 'power source': 'Battery', 'type of bulb': 'LED', 'batteries included?': 'Yes', 'batteries required?': 'Yes', 'battery cell type': 'Lithium Ion', 'battery description': 'Li-ion 21700', 'item weight': '272 g'}","#56,820 in Tools & Home Improvement (See Top 100 in Tools & Home Improvement)
#548 in Handheld Flashlights",https://images-na.ssl-images-amazon.com/images/I/71yeZR5sr8L._AC_SY355_.jpg
1,R32NZSZ2VLY0BF,True,What an amazingly powerful flashlight.,This flashlight has 5 settings and on high is absolutely amazing. Drains the battery faster as you go brighter but is still pretty good.,canada,"July 23, 2020",Tim Jantzen,5.0,0,2020-11-12 11:16:33.935479,2020-11-12 11:16:34.065132,Fenix PD36R 1600 Lumen USB rechargeable CREE LED tactical Flashlight with EdisonBright charging cable carry case bundle,4.8,144.95,,Tools & Home Improvement,B07TJ41TMC,,"#56,820 in Tools & Home Improvement (See Top 100 in Tools & Home Improvement)
#548 in Handheld Flashlights",https://images-na.ssl-images-amazon.com/images/I/71yeZR5sr8L._AC_SY355_.jpg
2,R3G0878G1A50RG,True,Love this light!,Couldnt ask for a better product. 5 out of 5 in all fields. Only dislike is it doesnt have the TAC mode and outdoor mode.,canada,"January 23, 2020",steven,5.0,0,2020-11-12 11:16:34.071116,2020-11-12 11:16:34.199772,Fenix PD36R 1600 Lumen USB rechargeable CREE LED tactical Flashlight with EdisonBright charging cable carry case bundle,4.8,144.95,,Tools & Home Improvement,B07TJ41TMC,,"#56,820 in Tools & Home Improvement (See Top 100 in Tools & Home Improvement)
#548 in Handheld Flashlights",https://images-na.ssl-images-amazon.com/images/I/71yeZR5sr8L._AC_SY355_.jpg
3,RQ81OBJA6BVPK,True,Product is as described.,Very happy with item. Works perfectly. It will blind a person within 30 yards. Recommended.,canada,"June 7, 2020",Mark King,5.0,1,2020-11-12 11:16:34.204759,2020-11-12 11:16:34.341393,Fenix PD36R 1600 Lumen USB rechargeable CREE LED tactical Flashlight with EdisonBright charging cable carry case bundle,4.8,144.95,,Tools & Home Improvement,B07TJ41TMC,,"#56,820 in Tools & Home Improvement (See Top 100 in Tools & Home Improvement)
#548 in Handheld Flashlights",https://images-na.ssl-images-amazon.com/images/I/71yeZR5sr8L._AC_SY355_.jpg
4,R2EXXQESFMNG76,True,Good product,Great for camping/ hunting very bright,canada,"July 31, 2020",Al Webster,5.0,0,2020-11-12 11:16:34.347377,2020-11-12 11:16:34.481020,Fenix PD36R 1600 Lumen USB rechargeable CREE LED tactical Flashlight with EdisonBright charging cable carry case bundle,4.8,144.95,,Tools & Home Improvement,B07TJ41TMC,,"#56,820 in Tools & Home Improvement (See Top 100 in Tools & Home Improvement)
#548 in Handheld Flashlights",https://images-na.ssl-images-amazon.com/images/I/71yeZR5sr8L._AC_SY355_.jpg
5,R2I7W9I2GAHX65,True,Awesome,"Very bright, good battery life. Might be the best flashlight of this size on the market.",canada,"November 8, 2019",Jordan Delanghe,5.0,0,2020-11-12 11:16:34.486007,2020-11-12 11:16:34.614664,Fenix PD36R 1600 Lumen USB rechargeable CREE LED tactical Flashlight with EdisonBright charging cable carry case bundle,4.8,144.95,,Tools & Home Improvement,B07TJ41TMC,,"#56,820 in Tools & Home Improvement (See Top 100 in Tools & Home Improvement)
#548 in Handheld Flashlights",https://images-na.ssl-images-amazon.com/images/I/71yeZR5sr8L._AC_SY355_.jpg
6,R3NEYWO5K1U9A7,False,"Awesome light, great company, fantastic battery life","I bought this light at a trade show earlier this year. It's my third Fenix light, different models in the past. All fantastic lights. This 5000 battery has excellent life between charges, providing you don't have it on level 5 all the time. The holder is a little snug as it's the same size as my PD35, but the body on the 36 is a bit larger. Although mine has a little ""Glitch"" every now and then, I haven't sent it back for warranty cuz I just love this light and don't want to be without it! Haha. (Every now and then it doesn't work, no light. So I unscrew the back, thighten it back up and it works, not a big deal, but a little annoying). Bottom line, forget about all the knock-off stuff, spend the money and get a real flashlight that will last a long time. Best light out there in my opinion.",canada,"July 24, 2020",Siuco,5.0,1,2020-11-12 11:16:34.619651,2020-11-12 11:16:34.741834,Fenix PD36R 1600 Lumen USB rechargeable CREE LED tactical Flashlight with EdisonBright charging cable carry case bundle,4.8,144.95,,Tools & Home Improvement,B07TJ41TMC,,"#56,820 in Tools & Home Improvement (See Top 100 in Tools & Home Improvement)
#548 in Handheld Flashlights",https://images-na.ssl-images-amazon.com/images/I/71yeZR5sr8L._AC_SY355_.jpg
7,R1T1FDKDCX569N,True,"Simply De-light-ful, but be warned","I purchased this flashlight because I saw the outstanding performance from other Fenix products my father owns and from the lasting shame and disappointment that comes with realizing a 3 D-cell LED Mag-Lite just isn't all that bright. I love this light.

The night it arrived, I plugged it in and waited patiently for it to charge so I could use it for my late night walk with the dog. When the charge indicator finally held green, I pulled out the charging cable, leashed the dog, and went out to test my new light source. Coming from a collection of LED Mag-Lites, nothing could have prepared me for the next few moments.

When I first switched the light on, it defaulted to the Eco intensity; this is roughly as bright as an LED 2 A-cell Mag-Lite. This is a good starting point, but this is an expensive light and, to quote Jeremy Clarkson, ""WE NEEEEED MOOOORE POWWWWUHHHHH,"" so I tapped the side button to go up to Low.

At Low, we're basically at the LED 2 or 3 D-cell Mag-Lite brightness, but in a beautiful, beam of light. I can feel the power I must be holding and I'm not sure if I am qualified to operate it, but there are three remaining levels and, being a man of science and culture, my domesticated dog-walking experiment must continue, so I bumped the intensity to Medium.

At Medium, the torch is throwing enough light that I'm beginning to question whether a 1600 lumen output could be the sort of thing that might require a permit or license to operate, but I'm unwaivered: I have to know how bright this is, so I tap the setting button up to High.

On High, the darkness ahead of me retreats back far enough that, though it was 10:30 PM, I thought the sun may be rising. I could clearly see details in the woods behind the house that I had previously seen only during daylight hours and I began to realize I may be disturbing woodland creatures and even neighbors as I shine this gorgeous light at everything around me like I would normally do with the far inferior lights I owned up until that night. In my excitement and amazement at the light this tiny device could produce, I nearly forgot about the Turbo setting, so in fear and awe, I tapped the button to go all the way to Turbo mode.

The light was blinding. It provided such illumination and clarity over a distance that, as I stared out into the world once covered in darkness, but now lit as if the sun had risen, I could glimpse past, present, and future. All the life events that brought me to this brilliant moment in time were simultaneously visible with the things that had not yet come and the wonderful high intensity flashlight experiences the future will hold.

The dog finished her business and I realized the flashlight had bonded a twig on the pavement to the cement at a molecular level. Nearby roosters stopped crowing because their work was done. Stars were no longer visible in the night sky from the light pollution emitting from this incredible device. As I walked back to the house, I realized the magnitude of what had just happened: while the rest of the world will continue to measure years of time as Before the Common Era (BCE) and Common Era (CE), I must hereto measure time as Before Fenix Flashlight (BFF) and Fenix Flashlight (FF).

Don't look for other products, just buy this. Buy ten of them and strap them together if you need to replace a lighthouse, a star, the light from an arc welder, or perhaps some sort of research-grade lighting apparatus used to test light absorption of materials like Vanta-Black or Black 2.0. This is the best possible lighting experience you can get for the money and if, like me, you are one of those poor fools who thought an LED Mag-Lite was bright, you can join the Brotherhood of Bright, Flashy Things and spread the gospel of Fenix lights and what it means to send darkness fleeing.",the united states,"November 29, 2019",Paul,5.0,0,2020-11-12 11:16:34.746828,2020-11-12 11:16:34.887333,Fenix PD36R 1600 Lumen USB rechargeable CREE LED tactical Flashlight with EdisonBright charging cable carry case bundle,4.8,144.95,,Tools & Home Improvement,B07TJ41TMC,,"#56,820 in Tools & Home Improvement (See Top 100 in Tools & Home Improvement)
#548 in Handheld Flashlights",https://images-na.ssl-images-amazon.com/images/I/71yeZR5sr8L._AC_SY355_.jpg
8,ROGNH7FOMI9U6,True,Better to order directly from Fenix!,"I love this flashlight. Probably one of the best I've seen for the size. The only reason for 3 stars is that the box the flashlight came in(not the shipping box) was smashed like someone stepped on it, and the battery case that is included from Edison is for a 18650, not the 21700 that comes with the flashlight. Also the price is about 20.00 cheaper if you order it directly through Fenix!",the united states,"September 6, 2019",Eric,3.0,0,2020-11-12 11:16:34.892317,2020-11-12 11:16:35.033939,Fenix PD36R 1600 Lumen USB rechargeable CREE LED tactical Flashlight with EdisonBright charging cable carry case bundle,4.8,144.95,,Tools & Home Improvement,B07TJ41TMC,,"#56,820 in Tools & Home Improvement (See Top 100 in Tools & Home Improvement)
#548 in Handheld Flashlights",https://images-na.ssl-images-amazon.com/images/I/71yeZR5sr8L._AC_SY355_.jpg
9,RY13OFORROQ00,True,Great duty light!,I have been using this for a duty light. I originally bought it as a backup but have been using it as my primary because of how well it works. The light is extremely bright and easily spotlights large areas at Max brightness while being able to dim it quickly to use when writing down information. I work 12 hour shifts and have been very pleased with the battery life in this light. Being able to charge it up when I get off so it is good to go was a major factor in why I went with this model and I am pleased with how it's lasting.,the united states,"August 23, 2019",Coleman D.,5.0,0,2020-11-12 11:16:35.037928,2020-11-12 11:16:35.227034,Fenix PD36R 1600 Lumen USB rechargeable CREE LED tactical Flashlight with EdisonBright charging cable carry case bundle,4.8,144.95,,Tools & Home Improvement,B07TJ41TMC,,"#56,820 in Tools & Home Improvement (See Top 100 in Tools & Home Improvement)
#548 in Handheld Flashlights",https://images-na.ssl-images-amazon.com/images/I/71yeZR5sr8L._AC_SY355_.jpg
10,RCCTWS3KZEL85,True,Flashlight is great. Almost worthless bundle.,"The Fenix PD36R is a great flashlight. It gets five stars. The bundle is worthless. Sure, you get an official ""EdisonBright charging cable carry case bundle"" (aka a short usb-c cable of questionable vintage and a cheap plastic case). I suppose you can store the magnificent charging cable in the case because nothing else will fit (it's too small to hold any spare batteries for the flashlight).
So, you do not have a short usb-c cable, this may be worth the slight extra cost over what Fenix is selling it for.",the united states,"July 29, 2019",m_a_s,5.0,0,2020-11-12 11:16:38.386370,2020-11-12 11:16:38.518565,Fenix PD36R 1600 Lumen USB rechargeable CREE LED tactical Flashlight with EdisonBright charging cable carry case bundle,4.8,144.95,,Tools & Home Improvement,B07TJ41TMC,,"#56,820 in Tools & Home Improvement (See Top 100 in Tools & Home Improvement)
#548 in Handheld Flashlights",https://images-na.ssl-images-amazon.com/images/I/71yeZR5sr8L._AC_SY355_.jpg
11,R8EQMQKYHRPBU,True,Quality,"I like that it’s crazy bright, 5000 mhA battery, usb rechargeable and the size. I don’t like that It can’t be tail stand, no direct access to turbo or strobe, there’s no spring on the led driver where it connects to the + part of the battery also the led tint is a little greenish compared to my 6 years old Fenix pd35.",the united states,"May 10, 2020",alexander,5.0,0,2020-11-12 11:16:38.523556,2020-11-12 11:16:38.657226,Fenix PD36R 1600 Lumen USB rechargeable CREE LED tactical Flashlight with EdisonBright charging cable carry case bundle,4.8,144.95,,Tools & Home Improvement,B07TJ41TMC,,"#56,820 in Tools & Home Improvement (See Top 100 in Tools & Home Improvement)
#548 in Handheld Flashlights",https://images-na.ssl-images-amazon.com/images/I/71yeZR5sr8L._AC_SY355_.jpg
12,R14KTDJUECRWFR,True,Don't hesitate,"I've used this flashlight on duty for a few weeks now, as well as on a camping trip for a week. It's worked flawlessly and honestly after getting roughed up and coming in and out of a duty belt everyday it still looks new! Not even a scratch. The battery lasts much longer then I expected it to and trust me, this thing is BRIGHT. Plus, being able to charge the battery with a modern cellphone charger is a huge plus.",the united states,"August 13, 2019",Matt,5.0,0,2020-11-12 11:16:38.663211,2020-11-12 11:16:38.805156,Fenix PD36R 1600 Lumen USB rechargeable CREE LED tactical Flashlight with EdisonBright charging cable carry case bundle,4.8,144.95,,Tools & Home Improvement,B07TJ41TMC,,"#56,820 in Tools & Home Improvement (See Top 100 in Tools & Home Improvement)
#548 in Handheld Flashlights",https://images-na.ssl-images-amazon.com/images/I/71yeZR5sr8L._AC_SY355_.jpg
13,R2LNS1CFQK8330,True,Very bright for its size. I need a dozen of these!,"Super bright light packed in a small but manageable size. Mode stays on what you set it to be until you decide to change it, meaning when you turn it on no need to select through the different levels of brightness each time. If you like full bright, it will be on full bright each time you turn it on. I need a dozen of these!",the united states,"August 21, 2019",Todd Pillard,5.0,0,2020-11-12 11:16:38.810148,2020-11-12 11:16:38.939222,Fenix PD36R 1600 Lumen USB rechargeable CREE LED tactical Flashlight with EdisonBright charging cable carry case bundle,4.8,144.95,,Tools & Home Improvement,B07TJ41TMC,,"#56,820 in Tools & Home Improvement (See Top 100 in Tools & Home Improvement)
#548 in Handheld Flashlights",https://images-na.ssl-images-amazon.com/images/I/71yeZR5sr8L._AC_SY355_.jpg
14,RFXBGTR3YH58N,True,wonderful edc!,"purchased pd35v2.0 camo i thought it was ultimate small edc.
when fenix intro pd36r i was hesitant cos didnt expect that big a difference.
after 2mths i decided lets buy n try.
WOW!!
glad i bought it finally.
now its my treasured edc.
fenix would need to intro pd36r digital camo edn or upgraded pd36r to make me replace my current pd36r.
great torch!",the united states,"September 26, 2019",eugene,4.0,0,2020-11-12 11:16:38.944208,2020-11-12 11:16:39.074942,Fenix PD36R 1600 Lumen USB rechargeable CREE LED tactical Flashlight with EdisonBright charging cable carry case bundle,4.8,144.95,,Tools & Home Improvement,B07TJ41TMC,,"#56,820 in Tools & Home Improvement (See Top 100 in Tools & Home Improvement)
#548 in Handheld Flashlights",https://images-na.ssl-images-amazon.com/images/I/71yeZR5sr8L._AC_SY355_.jpg
15,R33QSF6GHOJQZM,True,My new go-to light. Best light I’ve found in this size.,"Outstanding beam shape, with nice bright spot for throw plus a good amount of light around the edges. My new go-to light, replacing a more expensive but slightly dimmer Surefire. I also like the 5 different levels and MUCH longer runtime of the 5000mah battery. Pretty sure this is the best you can get right now in this size.",the united states,"August 27, 2019",G. Gough,5.0,0,2020-11-12 11:16:39.079929,2020-11-12 11:16:39.225921,Fenix PD36R 1600 Lumen USB rechargeable CREE LED tactical Flashlight with EdisonBright charging cable carry case bundle,4.8,144.95,,Tools & Home Improvement,B07TJ41TMC,,"#56,820 in Tools & Home Improvement (See Top 100 in Tools & Home Improvement)
#548 in Handheld Flashlights",https://images-na.ssl-images-amazon.com/images/I/71yeZR5sr8L._AC_SY355_.jpg
16,RCFSDVRKAN61D,True,Best first responder service light on or off duty,I bought this for my best friend for his birthday because he work in NYC for FDNY and how this flashlight design it absolute perfect for any first responder it has amazing memory system and it has momentarily lighting and its super light with the battery just put in your jeans and forget about it and the power on this is amazing and its type c charging my friend was speechless i gave him this flashlight but i rather him have the right tools to protect him self and save his life so with out doubt in my mind this the best light because the fact u can charge it for 10 minutes and get 150 lumen for 5 hours is amazing and fully charger at 1600 lumen for 2 hour and 50 minutes that like light saber at night pretty much lol like that isanely long for a flashlight that little like absolute blown away and i have surefire and nitecore spent way more money and the battery life really matter at the end of the day and build quality is insanely good i saw reviews say the rubber charging port breaks easily hell no i have enough convinced to throw that off a building because its solid,the united states,"September 11, 2020",Christian m,5.0,0,2020-11-12 11:16:39.230910,2020-11-12 11:16:39.363236,Fenix PD36R 1600 Lumen USB rechargeable CREE LED tactical Flashlight with EdisonBright charging cable carry case bundle,4.8,144.95,,Tools & Home Improvement,B07TJ41TMC,,"#56,820 in Tools & Home Improvement (See Top 100 in Tools & Home Improvement)
#548 in Handheld Flashlights",https://images-na.ssl-images-amazon.com/images/I/71yeZR5sr8L._AC_SY355_.jpg
17,RL6QFXNLDBLEP,True,"Only Time will tell if this review stays at 5 stars, but heck this thing is beautiful","I only ever owned Home Depot flashlights before I ever discovered the EDC lifestyle. Decided to get an Olight Baton 2 and was pleased with it but still carried my Milwaukee pen light since it felt short and was scared of it falling out of my pocket. Was looking at the 35 versions when this guy dropped, and this will probably be my last flashlight purchase ever or if Fenix drops a worthy successor. Not needing to carry ANOTHER cable to charge my flashlight would make it obsolete if I even lost the Olight charger, but I can just plug in the same USB C cable I use for my Samsung which I have both at home and in my truck and wouldn't have to worry about having a dead light.",the united states,"August 23, 2019",Joe,5.0,0,2020-11-12 11:16:39.368841,2020-11-12 11:16:39.497533,Fenix PD36R 1600 Lumen USB rechargeable CREE LED tactical Flashlight with EdisonBright charging cable carry case bundle,4.8,144.95,,Tools & Home Improvement,B07TJ41TMC,,"#56,820 in Tools & Home Improvement (See Top 100 in Tools & Home Improvement)
#548 in Handheld Flashlights",https://images-na.ssl-images-amazon.com/images/I/71yeZR5sr8L._AC_SY355_.jpg
18,RNCDGBY26QQUG,True,Great compat yet very bright!,"Personally, I think it's an amazing flashlight!
It's light weight and compact, yet has a long lasting battery.
It fully charges in about 4 hours give or take a few minutes. The rechargeable battery is great and uses a USB-C type charger.
The included one is only 6 inches long but any Android USB-C charger will work really...
From a full charge and constant use, my flashlight has lasted me about 3 nights.
It doesn't lose output as the battery drains, as in putting out weak or dim light when at the 1600 lumen or wherever setting you have it on. It either works at that brightness setting or it doesn't. If it does not have enough power to put out that level of intensity, it just skips over that setting all together.
I like that the light intensity button is flush against the body of the flashlight itself. It prevents it from accidentally getting caught on things as you're pulling it out or putting it back into the sheath, pocket, pouch, etc...
It is very durable as I've accidentally dropped it from various heights ranging from waist height to off the roof of a 1 storey building.
The included lanyard is great
(when you remember to actually put it around your wrist)
It has a good balance of both flood and pitch throughout all levels.

A few things that could be improved are:
1- The light intensity button to be able to scroll up and down the levels.
-- It only goes up in levels, and if you accidentally pass the level you want, you must go through all the levels to get to it again instead of just going back down 1 level.

2- The light intensity button to be more tactile.
-- It has a flat smooth button and easy to lose track of in the dark.
3- Have knurling or better grips down the body of the flashlight.
-- It is very slick and smooth all around making it slippery and easy to drop.

4- Having an actual lock out button or switch.
-- You can give it a quarter twist to simulate a ""lock out"" but you'll also be compromising the water tight seal to the battery as well...

5- Having a battery battery life indicator.
-- It has a 4 in 1 light indicator on the intensity button:
Solid green: Somewhere between 90-100% charge.
Flashing green: Somewhere between 10-89% charged.
Flashing red: Somewhere between 1-9%
Solid red: >1-0% basically dead...

5.5-- **is a subjective opinion** the sheath.
-- Personally as a security officer, I love the simplicity of the sheath. It's just a single fold over flap held down with velcro.
Means that I don't have to fumble around with any clasps, clips, buttons or anything. It's kind of snug and tight at first, but it stretches out a bit after use. I can easily draw my tools out when I need them, and put them away just as easily.
However, I could understand how a more robust sheath would be beneficial if you're a mountain climber, electrician, or someone who's going to be in compromising positions and need it to be secured down without a doubt.

All in all, it's a great flashlight and I definitely recommend it to anyone looking for a great flashlight for a decent price range.

**No I am not being paid by nor was the flashlight given to me for free by Fenix USA.
I bought this product myself with my own money and these are my honest thoughts and opinions on it.",the united states,"November 28, 2019",Israel,5.0,0,2020-11-12 11:16:39.503548,2020-11-12 11:16:39.635731,Fenix PD36R 1600 Lumen USB rechargeable CREE LED tactical Flashlight with EdisonBright charging cable carry case bundle,4.8,144.95,,Tools & Home Improvement,B07TJ41TMC,,"#56,820 in Tools & Home Improvement (See Top 100 in Tools & Home Improvement)
#548 in Handheld Flashlights",https://images-na.ssl-images-amazon.com/images/I/71yeZR5sr8L._AC_SY355_.jpg
19,R229NFXZ2VKL6T,True,Expensive paper weight,Flashlight was great for the first 6 months of ownership. The last 2 months out of the 8 have been terrible and now it’s just dead. Daily usage 5-6 days a week. Tried to contact Fenix via email and phone to request warranty with no response. To get 6 months out of a $100 + flashlight is terrible. And to not get any reply from a premium flashlight brand is worse. If you need something reliable don’t bother. Way too expensive to only get 6 month,the united states,"August 31, 2020",Amazon Customer,1.0,0,2020-11-12 11:16:39.640749,2020-11-12 11:16:39.773373,Fenix PD36R 1600 Lumen USB rechargeable CREE LED tactical Flashlight with EdisonBright charging cable carry case bundle,4.8,144.95,,Tools & Home Improvement,B07TJ41TMC,,"#56,820 in Tools & Home Improvement (See Top 100 in Tools & Home Improvement)
#548 in Handheld Flashlights",https://images-na.ssl-images-amazon.com/images/I/71yeZR5sr8L._AC_SY355_.jpg
