,author_id,verified_purchase,review_title,reviews,country,date,reviewer_name,ratings,people_find_helpful,start_time,end_time,product_name,average_rating,price,total_reviews,product_category,product_id,meta_data,rank,product_image_url
20,RGMF9AKTKK5LQ,True,My go-to illumination tool,"First off, I have to say this flashlight is on my duty belt as I work (police officer), and has 9 months of extremely hard use daily.

I have had a FENIX TK35 light for a decade, so I knew I was getting a quality light. This particular model is exemplary of the quality I had come to expect.

As you can see from the pictures, my flashlight has nicks scratches and dents. I use my equipment. But it has never failed to throw light, and it does so for a long time in between charges using any USB C cable. It’s lightweight and is of good size, extremely durable two-way pocket clip.

The on/off button and output settings are simple and intuitive. Fantastic light. 10/10 would recommend.",the united states,"October 27, 2020",Hunter Lawrence,5.0,0,2020-11-12 11:16:42.880894,2020-11-12 11:16:43.021412,Fenix PD36R 1600 Lumen USB rechargeable CREE LED tactical Flashlight with EdisonBright charging cable carry case bundle,4.8,144.95,,Tools & Home Improvement,B07TJ41TMC,,"#56,820 in Tools & Home Improvement (See Top 100 in Tools & Home Improvement)
#548 in Handheld Flashlights",https://images-na.ssl-images-amazon.com/images/I/71yeZR5sr8L._AC_SY355_.jpg
21,R2NB1LIYP57LZ5,True,Great light for the $$,"(Fenix PD36R 1600 Lumen USB rechargeable) Has become my go-to duty light. Compact, rechargeable bright led are must-have features and this light meets all. Bonus points: kit has everything I needed for charging, no hunting for a spare cord, etc, the clip is 2-way attachment type (never knew I wanted this feature till I got this), light has been dropped multiple times with no adverse damage. Con: The button for light setting (low, med, high setting) can be a pain to find/feel in an emergency. I have had zero problems with this light as my preferred duty light since purchasing.",the united states,"December 19, 2019",Monster,4.0,0,2020-11-12 11:16:43.026401,2020-11-12 11:16:43.154565,Fenix PD36R 1600 Lumen USB rechargeable CREE LED tactical Flashlight with EdisonBright charging cable carry case bundle,4.8,144.95,,Tools & Home Improvement,B07TJ41TMC,,"#56,820 in Tools & Home Improvement (See Top 100 in Tools & Home Improvement)
#548 in Handheld Flashlights",https://images-na.ssl-images-amazon.com/images/I/71yeZR5sr8L._AC_SY355_.jpg
22,RWMQGAFCU3I72,True,charging cover,"I do like the flashlight with one exception, the charging cover sucks and stopped staying closed. i carry this light every day for my work and love how bright it is, but the cover is an issue. I contacted Fenix and I was told EdisonBright warranties the product. I contacted EdisonBright, they advised they would send the part, the rubber seal, so I could fix it. Over a month passes and nothing, recontacted them and other than being sorry they failed to send the product I needed. Still have not received it. I finally contacted Fenix telling them what my isssue is, they informed me replacing the rubber cover would be near impossible and are sending me a replacement head. Not impressed with EdisonBright and would not buy from them agian. Customer service is number one with me, all it takes is comunication. I realize with everything going on things are crazy, but it's no different in China, and they sent me the replacement part the next day after contacting them.",the united states,"December 30, 2019",js wilson,2.0,0,2020-11-12 11:16:43.159554,2020-11-12 11:16:43.288202,Fenix PD36R 1600 Lumen USB rechargeable CREE LED tactical Flashlight with EdisonBright charging cable carry case bundle,4.8,144.95,,Tools & Home Improvement,B07TJ41TMC,,"#56,820 in Tools & Home Improvement (See Top 100 in Tools & Home Improvement)
#548 in Handheld Flashlights",https://images-na.ssl-images-amazon.com/images/I/71yeZR5sr8L._AC_SY355_.jpg
23,R2M7HKP36TS6GN,True,Stopped working right out of return or warranty time period,"Great flashlight, until it just stops working after a few months without being dropped or any other damage. Fenix refuses to repair or replace and sends me to the Amazon Seller who won't respond to my messages. This is my 4th Fenix flashlight in the last 4 years. The first 2 were gifts, then I'm the sucker who tried for 3 and 4. Each of these mysteriously stopped working. One was literally working, put into a desk drawer, then taken out to charge for a camping trip. Fully changed but just didn't work anymore. This last one worked just fine and was left under a bed. I fully charged it per the indicator light, but won't light up anymore. Avoid this brand unless you want to spend over $100 on a new flashlight every few months.",the united states,"August 6, 2020",Kindle Customer,1.0,0,2020-11-12 11:16:43.293188,2020-11-12 11:16:43.424572,Fenix PD36R 1600 Lumen USB rechargeable CREE LED tactical Flashlight with EdisonBright charging cable carry case bundle,4.8,144.95,,Tools & Home Improvement,B07TJ41TMC,,"#56,820 in Tools & Home Improvement (See Top 100 in Tools & Home Improvement)
#548 in Handheld Flashlights",https://images-na.ssl-images-amazon.com/images/I/71yeZR5sr8L._AC_SY355_.jpg
24,RNFKA4S94ACHK,True,Great Light but gets too hot,"I recently purchased this and I've used it a lot.bitb is indeed very bright I'll update a picture later and it feels really well built. HOWEVER, The only bad thing is that if you run it at full power it gets extremely hot rather quickly. Less than 2 minutes of non-stop light and it'll be scorching to the point where I'm worried it'll burn out or something one day in the near future. With that said, yes you don't always need high power but what's the point of a having it if you have to worry about how extremely hot it gets?",the united states,"September 7, 2020",Jonathan Guerrero,3.0,0,2020-11-12 11:16:43.428561,2020-11-12 11:16:43.559560,Fenix PD36R 1600 Lumen USB rechargeable CREE LED tactical Flashlight with EdisonBright charging cable carry case bundle,4.8,144.95,,Tools & Home Improvement,B07TJ41TMC,,"#56,820 in Tools & Home Improvement (See Top 100 in Tools & Home Improvement)
#548 in Handheld Flashlights",https://images-na.ssl-images-amazon.com/images/I/71yeZR5sr8L._AC_SY355_.jpg
25,R1HRZ20Q9QNQND,True,Failed immediately x 2,The light worked well till I connected the charger. After that it only worked on one setting and the light lit dimly while charging. This was the replacement of a return that had the same problem. I’ve stopped buying Fenix,the united states,"January 14, 2020",Charlie S,1.0,0,2020-11-12 11:16:43.564547,2020-11-12 11:16:43.694685,Fenix PD36R 1600 Lumen USB rechargeable CREE LED tactical Flashlight with EdisonBright charging cable carry case bundle,4.8,144.95,,Tools & Home Improvement,B07TJ41TMC,,"#56,820 in Tools & Home Improvement (See Top 100 in Tools & Home Improvement)
#548 in Handheld Flashlights",https://images-na.ssl-images-amazon.com/images/I/71yeZR5sr8L._AC_SY355_.jpg
26,R3IJAU49OKU9ZD,True,An amazingly bright flashlight. Highest recommendation I can give a product.,"The brightest small flashlight that I have ever owned. It has 5 modes of brightness, controlled by a small button on the side. Excellent flashlight that’s well built, comes with case or can be directly clipped on a belt or backpack, for instance. To recharge the battery you just plug in the USB plug directly into the flashlight instead of hassling with removing the battery. Worth every penny I paid for it. The highest recommendation I can give a product.",the united states,"March 24, 2020",CapNComeback,5.0,0,2020-11-12 11:16:43.699672,2020-11-12 11:16:43.829174,Fenix PD36R 1600 Lumen USB rechargeable CREE LED tactical Flashlight with EdisonBright charging cable carry case bundle,4.8,144.95,,Tools & Home Improvement,B07TJ41TMC,,"#56,820 in Tools & Home Improvement (See Top 100 in Tools & Home Improvement)
#548 in Handheld Flashlights",https://images-na.ssl-images-amazon.com/images/I/71yeZR5sr8L._AC_SY355_.jpg
27,R138U3PQEBQH9Q,True,Best flashlight ever!,"I’ve had many flashlights, but this one surpasses them all.
I’m an electrician and many times using my flashlight.
I’ve had cheap and expansive flashlights before, and this one is by far better.
Battery life is very long.
Brightness is super strong (never really needed to use the most brightness setting).
Compact, easy to store and carry.
Has a charging port which makes it easy to charge.

Would recommend to anyone who needs a good and durable flashlight",the united states,"May 21, 2020","Liked the massager, hard to get to the charging port",5.0,0,2020-11-12 11:16:43.833163,2020-11-12 11:16:43.965472,Fenix PD36R 1600 Lumen USB rechargeable CREE LED tactical Flashlight with EdisonBright charging cable carry case bundle,4.8,144.95,,Tools & Home Improvement,B07TJ41TMC,,"#56,820 in Tools & Home Improvement (See Top 100 in Tools & Home Improvement)
#548 in Handheld Flashlights",https://images-na.ssl-images-amazon.com/images/I/71yeZR5sr8L._AC_SY355_.jpg
28,R2ECF27Y57C00E,True,Flashlight stop working,"Your browser does not support HTML5 video.
 The flashlight stop working, same problem. With the pass flashlight.",the united states,"June 11, 2020",Enrique Gutierrez,1.0,0,2020-11-12 11:16:43.970454,2020-11-12 11:16:44.100053,Fenix PD36R 1600 Lumen USB rechargeable CREE LED tactical Flashlight with EdisonBright charging cable carry case bundle,4.8,144.95,,Tools & Home Improvement,B07TJ41TMC,,"#56,820 in Tools & Home Improvement (See Top 100 in Tools & Home Improvement)
#548 in Handheld Flashlights",https://images-na.ssl-images-amazon.com/images/I/71yeZR5sr8L._AC_SY355_.jpg
29,R17TF4NYIWTS40,True,What happened?? Help!!,"Was 100 percent!! Now it has heated up in my pocket twice ....burning up my pants....
Is it defective after only a few months?? Looking forward to hearing if anyone else has the same issue. I’m afraid it will start a fire.",the united states,"November 5, 2019",Debbie King,5.0,0,2020-11-12 11:16:44.105040,2020-11-12 11:16:44.236203,Fenix PD36R 1600 Lumen USB rechargeable CREE LED tactical Flashlight with EdisonBright charging cable carry case bundle,4.8,144.95,,Tools & Home Improvement,B07TJ41TMC,,"#56,820 in Tools & Home Improvement (See Top 100 in Tools & Home Improvement)
#548 in Handheld Flashlights",https://images-na.ssl-images-amazon.com/images/I/71yeZR5sr8L._AC_SY355_.jpg
30,RN6NKJB42WW6B,True,Limited battery type,"Great light, bright etc. I didn't realize what kind of battery this takes, thought I could substitute two 123 . Can't. My bad for not being more observant. However, will keep it, and buy extra battery, even though Amazon doesn't offer that, will buy from Fenix direct. Edison Bright, the seller, included a plastic battery holder, except the battery won't fit!!",the united states,"October 12, 2019",wolflover,4.0,0,2020-11-12 11:16:46.393764,2020-11-12 11:16:46.558141,Fenix PD36R 1600 Lumen USB rechargeable CREE LED tactical Flashlight with EdisonBright charging cable carry case bundle,4.8,144.95,,Tools & Home Improvement,B07TJ41TMC,,"#56,820 in Tools & Home Improvement (See Top 100 in Tools & Home Improvement)
#548 in Handheld Flashlights",https://images-na.ssl-images-amazon.com/images/I/71yeZR5sr8L._AC_SY355_.jpg
31,R3MMCF3V74H43Y,True,Very bright,"It’s very bright at the highest setting.
The battery took a lot longer to charge than four hours it fact the red light never went out. I used the light anyway fearing overcharging the battery. After a short use I recharged the battery and this time the green light did come on.
I like the light but the battery situation has to be watched.",the united states,"November 6, 2019",JBD,4.0,0,2020-11-12 11:16:46.564124,2020-11-12 11:16:46.704552,Fenix PD36R 1600 Lumen USB rechargeable CREE LED tactical Flashlight with EdisonBright charging cable carry case bundle,4.8,144.95,,Tools & Home Improvement,B07TJ41TMC,,"#56,820 in Tools & Home Improvement (See Top 100 in Tools & Home Improvement)
#548 in Handheld Flashlights",https://images-na.ssl-images-amazon.com/images/I/71yeZR5sr8L._AC_SY355_.jpg
32,R1E3DM1YCTRP4T,True,FENIX PD36 is AWESOME,"This is my first tactical style flashlight. I've extensively used Mag Industries for most of my working life as a maintenance tech. Fairly recently I've been using the DeWalt 1000 lumen, 20 volt max spotlight as my singular lighting option. I bought this PD36 for dog walking at night, but have found it far superior to Mag Industries as a compact working mini spotlight! You can dial back the light so you don't blind yourself in more enclosed spaces... can't do that with the DeWalt. There is an aftermarket red lens filter for the PD36 if you're needing that. Its aluminum so rinse saltwater off immediately.",the united states,"December 29, 2019",J Hall,5.0,0,2020-11-12 11:16:46.709539,2020-11-12 11:16:46.835910,Fenix PD36R 1600 Lumen USB rechargeable CREE LED tactical Flashlight with EdisonBright charging cable carry case bundle,4.8,144.95,,Tools & Home Improvement,B07TJ41TMC,,"#56,820 in Tools & Home Improvement (See Top 100 in Tools & Home Improvement)
#548 in Handheld Flashlights",https://images-na.ssl-images-amazon.com/images/I/71yeZR5sr8L._AC_SY355_.jpg
33,R1HTG5KD6PHQY9,True,Poor waterproofing,"I bought this light because I work in a food production plant and needed a good waterproof light for inspecting equipment after being cleaned. This light worked amazing for about 6 months. Unfortunately, the charging port has a cheap rubber cover that wore out and no longer stays closed. This has contributed to the light becoming extremely unreliable as it only turns on about half the time now. I'm going to contact Fenix and see if they will warranty it out, but I think the lower lumen model might be better since it has the charger port on the battery itself rather than the side of the light.",the united states,"February 6, 2020",Ike42,3.0,0,2020-11-12 11:16:46.841238,2020-11-12 11:16:46.967891,Fenix PD36R 1600 Lumen USB rechargeable CREE LED tactical Flashlight with EdisonBright charging cable carry case bundle,4.8,144.95,,Tools & Home Improvement,B07TJ41TMC,,"#56,820 in Tools & Home Improvement (See Top 100 in Tools & Home Improvement)
#548 in Handheld Flashlights",https://images-na.ssl-images-amazon.com/images/I/71yeZR5sr8L._AC_SY355_.jpg
34,R13P1XOU32AE62,True,Compact yet super bright,Light arrived as expected. I intended to use it as my backup light as a police officer but it quickly has become my primary. Two highest modes are actually too bright for car stops for me! Feels well made and a few guys I work with have already put theirs through hell with no issue. I like this one better having the charger built right in to the cap verses the older model having to remove the battery,the united states,"February 13, 2020",Brendan,5.0,0,2020-11-12 11:16:46.973916,2020-11-12 11:16:47.104244,Fenix PD36R 1600 Lumen USB rechargeable CREE LED tactical Flashlight with EdisonBright charging cable carry case bundle,4.8,144.95,,Tools & Home Improvement,B07TJ41TMC,,"#56,820 in Tools & Home Improvement (See Top 100 in Tools & Home Improvement)
#548 in Handheld Flashlights",https://images-na.ssl-images-amazon.com/images/I/71yeZR5sr8L._AC_SY355_.jpg
35,R1GB4DCUEW9Y9,True,My New Duty Light,"Bought this for duty use to replace my old Streamlight Stinger and so far it has withstood the abuse. The only complaint I have is battery life when running at full brightness, however I have yet to find a light which can provide both battery economy along with super bright performance. The pocket clip is nice, which is better than having to fumble around my duty belt to grab my light in a hurry. Five out of five !",the united states,"April 2, 2020",Travis,5.0,0,2020-11-12 11:16:47.110228,2020-11-12 11:16:47.239044,Fenix PD36R 1600 Lumen USB rechargeable CREE LED tactical Flashlight with EdisonBright charging cable carry case bundle,4.8,144.95,,Tools & Home Improvement,B07TJ41TMC,,"#56,820 in Tools & Home Improvement (See Top 100 in Tools & Home Improvement)
#548 in Handheld Flashlights",https://images-na.ssl-images-amazon.com/images/I/71yeZR5sr8L._AC_SY355_.jpg
36,R13B1HW7L2BWP3,True,Buy this flashlight,"This is hands down the brightest flashlight I own. Even the big D cell LED flashlight I own. This is my EDC. It might run on lowest setting for a total of 15 min a day. On its highest setting it will blind someone. The strobe is fast and bright. Uses a USB C charging cable, same as phone so I have the capability to charge at home/work/car anytime. Light turns green when full. Will come back in a few months to update it's durability.",the united states,"December 16, 2019",Zippo556,5.0,0,2020-11-12 11:16:47.244030,2020-11-12 11:16:47.374717,Fenix PD36R 1600 Lumen USB rechargeable CREE LED tactical Flashlight with EdisonBright charging cable carry case bundle,4.8,144.95,,Tools & Home Improvement,B07TJ41TMC,,"#56,820 in Tools & Home Improvement (See Top 100 in Tools & Home Improvement)
#548 in Handheld Flashlights",https://images-na.ssl-images-amazon.com/images/I/71yeZR5sr8L._AC_SY355_.jpg
37,R2JA4THMN1KP7W,True,Wicked bright and well built.,"This is the flashlight to have. Very bright, in fact much more bright than those other one here in Amazon that claim to be very bright but don’t compare to this, rechargeable batteries a big plus, quality built and different brightness settings. Brighter than my streamlight that cost me much more and without rechargeable feature.",the united states,"January 4, 2020",Mako,5.0,0,2020-11-12 11:16:47.379704,2020-11-12 11:16:47.509433,Fenix PD36R 1600 Lumen USB rechargeable CREE LED tactical Flashlight with EdisonBright charging cable carry case bundle,4.8,144.95,,Tools & Home Improvement,B07TJ41TMC,,"#56,820 in Tools & Home Improvement (See Top 100 in Tools & Home Improvement)
#548 in Handheld Flashlights",https://images-na.ssl-images-amazon.com/images/I/71yeZR5sr8L._AC_SY355_.jpg
38,RT1G8QQB48O13,True,The best flashlight ever :),"This is an excellent flashlight for a park ranger! We are mushroom hunters and animal caretakers on the side - this light is absolutely magnificent at night and in the darkened forest or for traffic control during festivals. However, it does get a bit hot on the brightest setting - there are several other settings to mitigate that. It's battery life is unparalleled and the rechargeable function is ace. I'm going to snag a second one soon!",the united states,"May 23, 2020",Ian,5.0,0,2020-11-12 11:16:47.514433,2020-11-12 11:16:47.643497,Fenix PD36R 1600 Lumen USB rechargeable CREE LED tactical Flashlight with EdisonBright charging cable carry case bundle,4.8,144.95,,Tools & Home Improvement,B07TJ41TMC,,"#56,820 in Tools & Home Improvement (See Top 100 in Tools & Home Improvement)
#548 in Handheld Flashlights",https://images-na.ssl-images-amazon.com/images/I/71yeZR5sr8L._AC_SY355_.jpg
39,R2WY8FOZCE9O3Q,True,"Brighter than expected, fast charges via USB-C","This is a very handy compact powerhouse of a light. Small enough to have on you while you work. I keep it with me while I’m out hiking. I was shocked at how bright this is, it’s almost like daylight. Great to carry with you on an evening walk. Indispensable if you work in small spaces like an electrical panel or a crawl space. This charged using another 36w USB-C charging brick I have in under an hour.",the united states,"August 1, 2020",Eric Jackson,5.0,0,2020-11-12 11:16:47.648484,2020-11-12 11:16:47.778069,Fenix PD36R 1600 Lumen USB rechargeable CREE LED tactical Flashlight with EdisonBright charging cable carry case bundle,4.8,144.95,,Tools & Home Improvement,B07TJ41TMC,,"#56,820 in Tools & Home Improvement (See Top 100 in Tools & Home Improvement)
#548 in Handheld Flashlights",https://images-na.ssl-images-amazon.com/images/I/71yeZR5sr8L._AC_SY355_.jpg
40,R2AFUFJLKOEY07,True,Best I’ve ever owned,"Battery lasts for at least a month with general daily use on low & medium with occasional ultra bright setting.
It’s extremely bright & throws VERY far.
Tough as nails!!!
Multi-directional pocket clip is perfect.
Design is amazing & comfortable to hold.
Light weight.
Charges fast.

Would like adjustable throw width but does not take away from the awesomeness of this thing in any way.",the united states,"October 17, 2020",Sabarblatoe,5.0,0,2020-11-12 11:16:52.896253,2020-11-12 11:16:53.058308,Fenix PD36R 1600 Lumen USB rechargeable CREE LED tactical Flashlight with EdisonBright charging cable carry case bundle,4.8,144.95,,Tools & Home Improvement,B07TJ41TMC,,"#56,820 in Tools & Home Improvement (See Top 100 in Tools & Home Improvement)
#548 in Handheld Flashlights",https://images-na.ssl-images-amazon.com/images/I/71yeZR5sr8L._AC_SY355_.jpg
41,R39B4DVXKKBN2S,True,Strong construct !!,"Just a bit bigger than my PD 35 Tac.
Which I like.
Almost an Identical construct as the pd 35, but rechargeable at the head.
Double way clip is nice as well. I'll re-review after this weekend.",the united states,"August 10, 2019",Mark,5.0,0,2020-11-12 11:16:53.063295,2020-11-12 11:16:53.193913,Fenix PD36R 1600 Lumen USB rechargeable CREE LED tactical Flashlight with EdisonBright charging cable carry case bundle,4.8,144.95,,Tools & Home Improvement,B07TJ41TMC,,"#56,820 in Tools & Home Improvement (See Top 100 in Tools & Home Improvement)
#548 in Handheld Flashlights",https://images-na.ssl-images-amazon.com/images/I/71yeZR5sr8L._AC_SY355_.jpg
42,R14V2J0OM0AJ3B,True,Fenix PD36R,"Well built, extremely bright and has a long lasting battery life. I also like the sealed quick connect charging cord setup so i don't have to remove the battery. Also, having multiple brightness settings come in handy for different circumstances. I'm very happy with this light.",the united states,"September 19, 2019",Chris M Hudson,5.0,0,2020-11-12 11:16:53.197902,2020-11-12 11:16:53.327449,Fenix PD36R 1600 Lumen USB rechargeable CREE LED tactical Flashlight with EdisonBright charging cable carry case bundle,4.8,144.95,,Tools & Home Improvement,B07TJ41TMC,,"#56,820 in Tools & Home Improvement (See Top 100 in Tools & Home Improvement)
#548 in Handheld Flashlights",https://images-na.ssl-images-amazon.com/images/I/71yeZR5sr8L._AC_SY355_.jpg
43,R25HOKJNWM7EPL,True,Best light around!,So your ready to have a small light that packs a punch? Buy here. These lights are absolutely amazing and i love mine. For how bright it is you would think it would have to be much larger. But this small lightweight illuminator packs a punch! Dont underestimate the power at all. Worth every penny for sure!,the united states,"December 16, 2019",Nick,5.0,0,2020-11-12 11:16:53.332435,2020-11-12 11:16:53.462661,Fenix PD36R 1600 Lumen USB rechargeable CREE LED tactical Flashlight with EdisonBright charging cable carry case bundle,4.8,144.95,,Tools & Home Improvement,B07TJ41TMC,,"#56,820 in Tools & Home Improvement (See Top 100 in Tools & Home Improvement)
#548 in Handheld Flashlights",https://images-na.ssl-images-amazon.com/images/I/71yeZR5sr8L._AC_SY355_.jpg
44,R22ANGXR7KIS0E,True,Very bright light,"Ordered for husband to keep in his turn-out gear, works very well and is extremely bright, just what he needed.",the united states,"September 22, 2019",dach,5.0,0,2020-11-12 11:16:53.467645,2020-11-12 11:16:53.597288,Fenix PD36R 1600 Lumen USB rechargeable CREE LED tactical Flashlight with EdisonBright charging cable carry case bundle,4.8,144.95,,Tools & Home Improvement,B07TJ41TMC,,"#56,820 in Tools & Home Improvement (See Top 100 in Tools & Home Improvement)
#548 in Handheld Flashlights",https://images-na.ssl-images-amazon.com/images/I/71yeZR5sr8L._AC_SY355_.jpg
45,R23VDYHBOGWTD6,True,Get an aftermarket holster,"$100 flashlight with a 10 cent holster. Takes two hands to release it from its cage, which is not a benefit when you spend your days in dark, tight spaces. The light itself is very nice, and the XSTAR holster I received today should improve the overall experience.",the united states,"September 22, 2020",K. Glasson,4.0,0,2020-11-12 11:16:53.603273,2020-11-12 11:16:53.733818,Fenix PD36R 1600 Lumen USB rechargeable CREE LED tactical Flashlight with EdisonBright charging cable carry case bundle,4.8,144.95,,Tools & Home Improvement,B07TJ41TMC,,"#56,820 in Tools & Home Improvement (See Top 100 in Tools & Home Improvement)
#548 in Handheld Flashlights",https://images-na.ssl-images-amazon.com/images/I/71yeZR5sr8L._AC_SY355_.jpg
46,R1SIXQC5QBZU2L,True,"very bright, every day carry","I like that it featured on-board charging port making it one less hassle. Love the high capacity 21700 secondary LiON cell.
Presented this to my brother for his birthday.",the united states,"November 30, 2019",R. DONG,5.0,0,2020-11-12 11:16:53.738806,2020-11-12 11:16:53.865758,Fenix PD36R 1600 Lumen USB rechargeable CREE LED tactical Flashlight with EdisonBright charging cable carry case bundle,4.8,144.95,,Tools & Home Improvement,B07TJ41TMC,,"#56,820 in Tools & Home Improvement (See Top 100 in Tools & Home Improvement)
#548 in Handheld Flashlights",https://images-na.ssl-images-amazon.com/images/I/71yeZR5sr8L._AC_SY355_.jpg
