,author_id,verified_purchase,review_title,reviews,country,date,reviewer_name,ratings,people_find_helpful,start_time,end_time,product_name,average_rating,price,total_reviews,product_category,product_id,meta_data,rank,product_image_url
58,R3R9F0SEXD4C95,True,Four Stars,Super bright but no focal ring. Flood is the only option,the united states,"May 16, 2017",von Busse,4.0,0,2020-11-12 15:19:23.148978,2020-11-12 15:19:23.298340,"Nitecore MH10 CREE XM-L2 U2 LED 1000 Lumen USB Rechargeable Flashlight, 18650 Rechargeable Li-ion Battery, USB Charging Cable and Holster with 2 X EdisonBright CR123A Lithium Batteries",4.0,133.08,,Tools & Home Improvement,B00T922CFQ,,,https://images-na.ssl-images-amazon.com/images/I/71GiY5K7EML._AC_SX425_.jpg
59,R3NYDTAOJIGMM5,True,Five Stars,Dropped plenty of times and still shinning bright!!,the united states,"May 17, 2017",pussaint,5.0,0,2020-11-12 15:19:23.305087,2020-11-12 15:19:23.452474,"Nitecore MH10 CREE XM-L2 U2 LED 1000 Lumen USB Rechargeable Flashlight, 18650 Rechargeable Li-ion Battery, USB Charging Cable and Holster with 2 X EdisonBright CR123A Lithium Batteries",4.0,133.08,,Tools & Home Improvement,B00T922CFQ,,,https://images-na.ssl-images-amazon.com/images/I/71GiY5K7EML._AC_SX425_.jpg
60,R262FTPZ2IMNKI,True,Solid flashlight for duty use,"I'm very impressed with this flashlight. It's got a solidly constructed body and rubberized buttons and a rubber cover for the charging port (which takes standard USB plugs. Probably the same one you have for your phone if you have an Android smartphone). Controls are simple; there's only one button and its on/off or push and hold to cycle through the brightness levels. The belt case is a full enclosure with a Velcro strap that holds out in securely. In addition to the rechargeable battery, there were also two disposable batteries you could carry for backup.

The only downside so far is that the control button and the USB port cover are around the same size and feel and are located opposite each other on the case. It makes them indistinguishable to the touch and you'll try and press the charging port cover sometimes. It's a fairly minor annoyance.",the united states,"January 5, 2016",Barry D. Johnson,5.0,0,2020-11-12 15:19:27.578088,2020-11-12 15:19:27.776747,"Nitecore MH10 CREE XM-L2 U2 LED 1000 Lumen USB Rechargeable Flashlight, 18650 Rechargeable Li-ion Battery, USB Charging Cable and Holster with 2 X EdisonBright CR123A Lithium Batteries",4.0,133.08,,Tools & Home Improvement,B00T922CFQ,,,https://images-na.ssl-images-amazon.com/images/I/71GiY5K7EML._AC_SX425_.jpg
61,R3QZ6BCFOF5U2N,True,One Star,I received a light that was not a nitrcore,the united states,"November 8, 2017",jlb,1.0,0,2020-11-12 15:19:27.782611,2020-11-12 15:19:27.925773,"Nitecore MH10 CREE XM-L2 U2 LED 1000 Lumen USB Rechargeable Flashlight, 18650 Rechargeable Li-ion Battery, USB Charging Cable and Holster with 2 X EdisonBright CR123A Lithium Batteries",4.0,133.08,,Tools & Home Improvement,B00T922CFQ,,,https://images-na.ssl-images-amazon.com/images/I/71GiY5K7EML._AC_SX425_.jpg
62,R3BYPXQZCGEGLD,True,Four Stars,Great light. however it drains the batteries really fast,the united states,"August 14, 2016",Trell,4.0,0,2020-11-12 15:19:27.930812,2020-11-12 15:19:28.075686,"Nitecore MH10 CREE XM-L2 U2 LED 1000 Lumen USB Rechargeable Flashlight, 18650 Rechargeable Li-ion Battery, USB Charging Cable and Holster with 2 X EdisonBright CR123A Lithium Batteries",4.0,133.08,,Tools & Home Improvement,B00T922CFQ,,,https://images-na.ssl-images-amazon.com/images/I/71GiY5K7EML._AC_SX425_.jpg
63,RROP023B1UQZP,True,Five Stars,great flashlight.,the united states,"April 10, 2018",sounddudesteve,5.0,0,2020-11-12 15:19:28.080811,2020-11-12 15:19:28.226181,"Nitecore MH10 CREE XM-L2 U2 LED 1000 Lumen USB Rechargeable Flashlight, 18650 Rechargeable Li-ion Battery, USB Charging Cable and Holster with 2 X EdisonBright CR123A Lithium Batteries",4.0,133.08,,Tools & Home Improvement,B00T922CFQ,,,https://images-na.ssl-images-amazon.com/images/I/71GiY5K7EML._AC_SX425_.jpg
64,R1GOKA3JIRXRP9,True,Great overall.,"This flashlight came on time and, with the detailed instructions from the box to help get the hang of the different button pushes and functions, has been an invaluable and so far very reliable tool. The variable brightness is a great feature for different situations and it is quite sturdy and well made. Gets my like.",the united states,"November 29, 2015",Amazon Customer,5.0,0,2020-11-12 15:19:28.232328,2020-11-12 15:19:28.393797,"Nitecore MH10 CREE XM-L2 U2 LED 1000 Lumen USB Rechargeable Flashlight, 18650 Rechargeable Li-ion Battery, USB Charging Cable and Holster with 2 X EdisonBright CR123A Lithium Batteries",4.0,133.08,,Tools & Home Improvement,B00T922CFQ,,,https://images-na.ssl-images-amazon.com/images/I/71GiY5K7EML._AC_SX425_.jpg
65,R3JIXNHFY0AW9S,True,It does light up a wide area but its not good for distance,"The on/off button is hard to locate, it's to close to the USB port. They both feel the same at night. It does light up a wide area but its not good for distance.",the united states,"March 5, 2018",Mike Demaline,3.0,0,2020-11-12 15:19:28.399486,2020-11-12 15:19:28.560267,"Nitecore MH10 CREE XM-L2 U2 LED 1000 Lumen USB Rechargeable Flashlight, 18650 Rechargeable Li-ion Battery, USB Charging Cable and Holster with 2 X EdisonBright CR123A Lithium Batteries",4.0,133.08,,Tools & Home Improvement,B00T922CFQ,,,https://images-na.ssl-images-amazon.com/images/I/71GiY5K7EML._AC_SX425_.jpg
66,R2K3AM7BYB9BKT,True,Five Stars,Turns on and off. Bright. Whoa!,the united states,"March 23, 2018",The Jake G,5.0,0,2020-11-12 15:19:28.566251,2020-11-12 15:19:28.723173,"Nitecore MH10 CREE XM-L2 U2 LED 1000 Lumen USB Rechargeable Flashlight, 18650 Rechargeable Li-ion Battery, USB Charging Cable and Holster with 2 X EdisonBright CR123A Lithium Batteries",4.0,133.08,,Tools & Home Improvement,B00T922CFQ,,,https://images-na.ssl-images-amazon.com/images/I/71GiY5K7EML._AC_SX425_.jpg
67,R26PSB5NSLBMWD,True,5 stars,Lights up a whole room and I love that you can recharge it.,the united states,"May 23, 2016",niel,5.0,0,2020-11-12 15:19:28.729650,2020-11-12 15:19:28.887206,"Nitecore MH10 CREE XM-L2 U2 LED 1000 Lumen USB Rechargeable Flashlight, 18650 Rechargeable Li-ion Battery, USB Charging Cable and Holster with 2 X EdisonBright CR123A Lithium Batteries",4.0,133.08,,Tools & Home Improvement,B00T922CFQ,,,https://images-na.ssl-images-amazon.com/images/I/71GiY5K7EML._AC_SX425_.jpg
68,R2UULWX8WBTYC3,True,Five Stars,"great light! first light of this brand i have purchased, impressed with the quality.",the united states,"August 6, 2015",Zachary M. Swaim,5.0,0,2020-11-12 15:19:28.894760,2020-11-12 15:19:29.050472,"Nitecore MH10 CREE XM-L2 U2 LED 1000 Lumen USB Rechargeable Flashlight, 18650 Rechargeable Li-ion Battery, USB Charging Cable and Holster with 2 X EdisonBright CR123A Lithium Batteries",4.0,133.08,,Tools & Home Improvement,B00T922CFQ,,,https://images-na.ssl-images-amazon.com/images/I/71GiY5K7EML._AC_SX425_.jpg
69,RP34HPU10DGRL,True,Recharging port breaks easy,EDC use would be better if button would be at end of flashlight for better tactical use. Not bad though,the united states,"June 26, 2018",Jonny Bravo ,3.0,0,2020-11-12 15:19:29.056736,2020-11-12 15:19:29.211153,"Nitecore MH10 CREE XM-L2 U2 LED 1000 Lumen USB Rechargeable Flashlight, 18650 Rechargeable Li-ion Battery, USB Charging Cable and Holster with 2 X EdisonBright CR123A Lithium Batteries",4.0,133.08,,Tools & Home Improvement,B00T922CFQ,,,https://images-na.ssl-images-amazon.com/images/I/71GiY5K7EML._AC_SX425_.jpg
70,R2OS8BYLKO1PYS,True,Five Stars,Really like this! Use for doing medical rounds.,the united states,"March 8, 2016",DGR,5.0,0,2020-11-12 15:19:35.328856,2020-11-12 15:19:35.593751,"Nitecore MH10 CREE XM-L2 U2 LED 1000 Lumen USB Rechargeable Flashlight, 18650 Rechargeable Li-ion Battery, USB Charging Cable and Holster with 2 X EdisonBright CR123A Lithium Batteries",4.0,133.08,,Tools & Home Improvement,B00T922CFQ,,,https://images-na.ssl-images-amazon.com/images/I/71GiY5K7EML._AC_SX425_.jpg
71,R1KTI5GAZHRUG1,True,Light is great for police work...,"What a deal for the money, my son loves it for his police work.",the united states,"May 22, 2016",Larry,5.0,0,2020-11-12 15:19:35.602729,2020-11-12 15:19:35.833564,"Nitecore MH10 CREE XM-L2 U2 LED 1000 Lumen USB Rechargeable Flashlight, 18650 Rechargeable Li-ion Battery, USB Charging Cable and Holster with 2 X EdisonBright CR123A Lithium Batteries",4.0,133.08,,Tools & Home Improvement,B00T922CFQ,,,https://images-na.ssl-images-amazon.com/images/I/71GiY5K7EML._AC_SX425_.jpg
72,R2Z9VGM5CQTVQ1,True,"Excelente calidad, y muy confiable",Tremenda herramienta,the united states,"December 22, 2018",Daniel Ageitos,5.0,0,2020-11-12 15:19:35.839766,2020-11-12 15:19:35.992131,"Nitecore MH10 CREE XM-L2 U2 LED 1000 Lumen USB Rechargeable Flashlight, 18650 Rechargeable Li-ion Battery, USB Charging Cable and Holster with 2 X EdisonBright CR123A Lithium Batteries",4.0,133.08,,Tools & Home Improvement,B00T922CFQ,,,https://images-na.ssl-images-amazon.com/images/I/71GiY5K7EML._AC_SX425_.jpg
73,R1W51UARYVB4M,True,Would recommend.,Very bright light. Would recommend.,the united states,"September 21, 2016",DJ DAN,5.0,0,2020-11-12 15:19:35.997489,2020-11-12 15:19:36.141886,"Nitecore MH10 CREE XM-L2 U2 LED 1000 Lumen USB Rechargeable Flashlight, 18650 Rechargeable Li-ion Battery, USB Charging Cable and Holster with 2 X EdisonBright CR123A Lithium Batteries",4.0,133.08,,Tools & Home Improvement,B00T922CFQ,,,https://images-na.ssl-images-amazon.com/images/I/71GiY5K7EML._AC_SX425_.jpg
74,R2QSR0MJBAZPKE,True,Five Stars,Best product ever..it has more light than another flashlight.,the united states,"February 4, 2016",Priscilla G Lester,5.0,0,2020-11-12 15:19:36.148648,2020-11-12 15:19:36.297217,"Nitecore MH10 CREE XM-L2 U2 LED 1000 Lumen USB Rechargeable Flashlight, 18650 Rechargeable Li-ion Battery, USB Charging Cable and Holster with 2 X EdisonBright CR123A Lithium Batteries",4.0,133.08,,Tools & Home Improvement,B00T922CFQ,,,https://images-na.ssl-images-amazon.com/images/I/71GiY5K7EML._AC_SX425_.jpg
75,R714M35VXGDN0,True,Great for leos,Good bright light nice case and easy recharge,the united states,"April 29, 2016",Brian mc,5.0,0,2020-11-12 15:19:36.304097,2020-11-12 15:19:36.455917,"Nitecore MH10 CREE XM-L2 U2 LED 1000 Lumen USB Rechargeable Flashlight, 18650 Rechargeable Li-ion Battery, USB Charging Cable and Holster with 2 X EdisonBright CR123A Lithium Batteries",4.0,133.08,,Tools & Home Improvement,B00T922CFQ,,,https://images-na.ssl-images-amazon.com/images/I/71GiY5K7EML._AC_SX425_.jpg
76,R3GLUVT8W80YFU,True,Super bright for it's size!,"Love these flashlights, super bright, easy to charge same charger as my phone. Carry one with me everywhere convenient size and brightness for work, edc, or whatever.",the united states,"October 6, 2015",Kyle Putker,5.0,0,2020-11-12 15:19:36.462443,2020-11-12 15:19:36.647278,"Nitecore MH10 CREE XM-L2 U2 LED 1000 Lumen USB Rechargeable Flashlight, 18650 Rechargeable Li-ion Battery, USB Charging Cable and Holster with 2 X EdisonBright CR123A Lithium Batteries",4.0,133.08,,Tools & Home Improvement,B00T922CFQ,,,https://images-na.ssl-images-amazon.com/images/I/71GiY5K7EML._AC_SX425_.jpg
77,R1B7EAPIFZ4QE5,True,Great light,I use this light every day. Nice compact and bright,the united states,"March 7, 2020",Cliff Z,5.0,0,2020-11-12 15:19:36.653876,2020-11-12 15:19:36.799984,"Nitecore MH10 CREE XM-L2 U2 LED 1000 Lumen USB Rechargeable Flashlight, 18650 Rechargeable Li-ion Battery, USB Charging Cable and Holster with 2 X EdisonBright CR123A Lithium Batteries",4.0,133.08,,Tools & Home Improvement,B00T922CFQ,,,https://images-na.ssl-images-amazon.com/images/I/71GiY5K7EML._AC_SX425_.jpg
78,R3EC6VL72WM8K6,True,Awesome light!,Very bright and great value for the price!,the united states,"May 9, 2016",BartC,5.0,0,2020-11-12 15:19:36.805742,2020-11-12 15:19:36.955194,"Nitecore MH10 CREE XM-L2 U2 LED 1000 Lumen USB Rechargeable Flashlight, 18650 Rechargeable Li-ion Battery, USB Charging Cable and Holster with 2 X EdisonBright CR123A Lithium Batteries",4.0,133.08,,Tools & Home Improvement,B00T922CFQ,,,https://images-na.ssl-images-amazon.com/images/I/71GiY5K7EML._AC_SX425_.jpg
79,RWTUS068RNKJQ,True,Excellent Light,Very bright. I use it for running in the dark and usually only need it on the 2nd (of 4) brightness.,the united states,"November 22, 2015",M Ford,5.0,0,2020-11-12 15:19:36.961778,2020-11-12 15:19:37.126471,"Nitecore MH10 CREE XM-L2 U2 LED 1000 Lumen USB Rechargeable Flashlight, 18650 Rechargeable Li-ion Battery, USB Charging Cable and Holster with 2 X EdisonBright CR123A Lithium Batteries",4.0,133.08,,Tools & Home Improvement,B00T922CFQ,,,https://images-na.ssl-images-amazon.com/images/I/71GiY5K7EML._AC_SX425_.jpg
80,R2SAW0PSEQ70EV,True,Ordered two and both didn’t work,Didn’t work that’s the second one I’ve ordered and sent back,the united states,"August 21, 2018",tilford bozeman,1.0,0,2020-11-12 15:19:40.283276,2020-11-12 15:19:40.411616,"Nitecore MH10 CREE XM-L2 U2 LED 1000 Lumen USB Rechargeable Flashlight, 18650 Rechargeable Li-ion Battery, USB Charging Cable and Holster with 2 X EdisonBright CR123A Lithium Batteries",4.0,133.08,,Tools & Home Improvement,B00T922CFQ,,,https://images-na.ssl-images-amazon.com/images/I/71GiY5K7EML._AC_SX425_.jpg
81,R281O5YMDCJ98L,True,One Star,Flash light would not charge after only using it for a week. Now it's junk!,the united states,"September 8, 2017",brian,1.0,0,2020-11-12 15:19:40.417991,2020-11-12 15:19:40.572949,"Nitecore MH10 CREE XM-L2 U2 LED 1000 Lumen USB Rechargeable Flashlight, 18650 Rechargeable Li-ion Battery, USB Charging Cable and Holster with 2 X EdisonBright CR123A Lithium Batteries",4.0,133.08,,Tools & Home Improvement,B00T922CFQ,,,https://images-na.ssl-images-amazon.com/images/I/71GiY5K7EML._AC_SX425_.jpg
82,R53OV2234MV95,True,sleek case is a great plus,"slender case fits nicely in my pocket.
built in charge port is awesome
it is always near by.",the united states,"September 13, 2016",Chuck McGuire,5.0,0,2020-11-12 15:19:40.578904,2020-11-12 15:19:40.728652,"Nitecore MH10 CREE XM-L2 U2 LED 1000 Lumen USB Rechargeable Flashlight, 18650 Rechargeable Li-ion Battery, USB Charging Cable and Holster with 2 X EdisonBright CR123A Lithium Batteries",4.0,133.08,,Tools & Home Improvement,B00T922CFQ,,,https://images-na.ssl-images-amazon.com/images/I/71GiY5K7EML._AC_SX425_.jpg
83,R2O1GJS2BALN8,True,I really liked my Foursevens but wanted to save a little money,"I ordered this light to replace a more costly Foursevens MMR-X. I really liked my Foursevens but wanted to save a little money. I use it for narcotics related police work and always carry my lights unholstered in a cargo pocket. You can NOT do that with this light because the switch is on the side and is easily turned on inadvertently during the normal course of my tour. Going unnoticed this light will turn pretty hot. Also, compared to the Foursevens, I would say this extra $25 is worth it. I did like the Nitecore and it is worth its cost but the light should be carried in its holster. I can not give this light a full fair review because I had to return it for the reason I stated. The overall fit and finish I would classify as high end Chinese made.",the united states,"January 1, 2016",Pezrock,3.0,0,2020-11-12 15:19:40.733907,2020-11-12 15:19:40.888000,"Nitecore MH10 CREE XM-L2 U2 LED 1000 Lumen USB Rechargeable Flashlight, 18650 Rechargeable Li-ion Battery, USB Charging Cable and Holster with 2 X EdisonBright CR123A Lithium Batteries",4.0,133.08,,Tools & Home Improvement,B00T922CFQ,,,https://images-na.ssl-images-amazon.com/images/I/71GiY5K7EML._AC_SX425_.jpg
84,R2PEIIXKTEGDL6,True,Five Stars,Great product and great seller!,the united states,"December 3, 2015",K miranda,5.0,0,2020-11-12 15:19:40.893780,2020-11-12 15:19:41.045674,"Nitecore MH10 CREE XM-L2 U2 LED 1000 Lumen USB Rechargeable Flashlight, 18650 Rechargeable Li-ion Battery, USB Charging Cable and Holster with 2 X EdisonBright CR123A Lithium Batteries",4.0,133.08,,Tools & Home Improvement,B00T922CFQ,,,https://images-na.ssl-images-amazon.com/images/I/71GiY5K7EML._AC_SX425_.jpg
85,R2GBGC0G8MG3MC,True,Five Stars,Exellent,the united states,"June 17, 2016",Klad31,5.0,0,2020-11-12 15:19:41.052841,2020-11-12 15:19:41.208713,"Nitecore MH10 CREE XM-L2 U2 LED 1000 Lumen USB Rechargeable Flashlight, 18650 Rechargeable Li-ion Battery, USB Charging Cable and Holster with 2 X EdisonBright CR123A Lithium Batteries",4.0,133.08,,Tools & Home Improvement,B00T922CFQ,,,https://images-na.ssl-images-amazon.com/images/I/71GiY5K7EML._AC_SX425_.jpg
86,R34BYXVVKMT9DW,True,"great lamp, built very well","great lamp, built very well, and bright! great product..",the united states,"May 7, 2015",mysticman76,5.0,0,2020-11-12 15:19:41.214807,2020-11-12 15:19:41.398830,"Nitecore MH10 CREE XM-L2 U2 LED 1000 Lumen USB Rechargeable Flashlight, 18650 Rechargeable Li-ion Battery, USB Charging Cable and Holster with 2 X EdisonBright CR123A Lithium Batteries",4.0,133.08,,Tools & Home Improvement,B00T922CFQ,,,https://images-na.ssl-images-amazon.com/images/I/71GiY5K7EML._AC_SX425_.jpg
87,R2N7VQZM9ETTW3,True,Two Stars,It switches settings spontaneously.,the united states,"August 29, 2016",Christopher Hall,2.0,0,2020-11-12 15:19:41.406614,2020-11-12 15:19:41.582576,"Nitecore MH10 CREE XM-L2 U2 LED 1000 Lumen USB Rechargeable Flashlight, 18650 Rechargeable Li-ion Battery, USB Charging Cable and Holster with 2 X EdisonBright CR123A Lithium Batteries",4.0,133.08,,Tools & Home Improvement,B00T922CFQ,,,https://images-na.ssl-images-amazon.com/images/I/71GiY5K7EML._AC_SX425_.jpg
88,R1M4OAQ04XG4MJ,True,Perfect pocket light,"I really love this light. Quality material and workmanship. Once you learn the sequences it is very easy to scroll through the options. Though it runs on the c123 batteries, I prefer the 18650 rechargeable batteries. So easy to plug into a USB wall or vehicle charger. I have tons of flashlights, but I find myself using this one most of the time. Fits well in a front pocket without being bulky. It's bright as hell on high and the strobe function is truly blinding. Not sure if I would use it as a primary defense tool, but it is useful at pissing of annoying family members. Would be perfect if it had a tail cap switch",the united states,"March 8, 2017",creamer,5.0,0,2020-11-12 15:19:41.587301,2020-11-12 15:19:41.732724,"Nitecore MH10 CREE XM-L2 U2 LED 1000 Lumen USB Rechargeable Flashlight, 18650 Rechargeable Li-ion Battery, USB Charging Cable and Holster with 2 X EdisonBright CR123A Lithium Batteries",4.0,133.08,,Tools & Home Improvement,B00T922CFQ,,,https://images-na.ssl-images-amazon.com/images/I/71GiY5K7EML._AC_SX425_.jpg
89,R3JFZMPMFL4COO,True,Good Compact Flashlight,"Very good flashlight, small and bright and can be charged from my laptop.",the united states,"March 28, 2015",Nick,5.0,0,2020-11-12 15:19:41.737877,2020-11-12 15:19:41.890320,"Nitecore MH10 CREE XM-L2 U2 LED 1000 Lumen USB Rechargeable Flashlight, 18650 Rechargeable Li-ion Battery, USB Charging Cable and Holster with 2 X EdisonBright CR123A Lithium Batteries",4.0,133.08,,Tools & Home Improvement,B00T922CFQ,,,https://images-na.ssl-images-amazon.com/images/I/71GiY5K7EML._AC_SX425_.jpg
90,R1MULWOT8SS167,True,It is very difficult to turn on at night when ...,It is very difficult to turn on at night when you can't see it. They need a raised button for easier access that you can feel. Just a suggestion for improvement.,the united states,"July 30, 2016",Jack Schmitz,3.0,0,2020-11-12 15:19:48.021687,2020-11-12 15:19:48.256563,"Nitecore MH10 CREE XM-L2 U2 LED 1000 Lumen USB Rechargeable Flashlight, 18650 Rechargeable Li-ion Battery, USB Charging Cable and Holster with 2 X EdisonBright CR123A Lithium Batteries",4.0,133.08,,Tools & Home Improvement,B00T922CFQ,,,https://images-na.ssl-images-amazon.com/images/I/71GiY5K7EML._AC_SX425_.jpg
91,R2JCWTGGFQY9G5,True,Four Stars,great product.,the united states,"May 6, 2015",Bill,4.0,0,2020-11-12 15:19:48.256563,2020-11-12 15:19:48.501030,"Nitecore MH10 CREE XM-L2 U2 LED 1000 Lumen USB Rechargeable Flashlight, 18650 Rechargeable Li-ion Battery, USB Charging Cable and Holster with 2 X EdisonBright CR123A Lithium Batteries",4.0,133.08,,Tools & Home Improvement,B00T922CFQ,,,https://images-na.ssl-images-amazon.com/images/I/71GiY5K7EML._AC_SX425_.jpg
92,RBW2V94HZRW2G,True,Great flashlight,Love this flashlight! Small and very bright when u needed to turn the brightness level up.,the united states,"March 24, 2016",Stan Oskiera,5.0,0,2020-11-12 15:19:48.509770,2020-11-12 15:19:48.736714,"Nitecore MH10 CREE XM-L2 U2 LED 1000 Lumen USB Rechargeable Flashlight, 18650 Rechargeable Li-ion Battery, USB Charging Cable and Holster with 2 X EdisonBright CR123A Lithium Batteries",4.0,133.08,,Tools & Home Improvement,B00T922CFQ,,,https://images-na.ssl-images-amazon.com/images/I/71GiY5K7EML._AC_SX425_.jpg
93,R3G6ID1G6GG2YF,True,Five Stars,Works great and keeps its charge,the united states,"March 21, 2018",Socref,5.0,0,2020-11-12 15:19:48.741914,2020-11-12 15:19:48.998190,"Nitecore MH10 CREE XM-L2 U2 LED 1000 Lumen USB Rechargeable Flashlight, 18650 Rechargeable Li-ion Battery, USB Charging Cable and Holster with 2 X EdisonBright CR123A Lithium Batteries",4.0,133.08,,Tools & Home Improvement,B00T922CFQ,,,https://images-na.ssl-images-amazon.com/images/I/71GiY5K7EML._AC_SX425_.jpg
94,R11SCHNKTPNZ2P,True,Excellent battery life.,"Outstanding light, only complaint is the on/off switch is opposite from the charging port and hard to tell which is which by feel. Small problem for a excellent rechargeable flashlight.",the united states,"May 20, 2015",SmokinBozo,4.0,0,2020-11-12 15:19:49.007149,2020-11-12 15:19:49.227725,"Nitecore MH10 CREE XM-L2 U2 LED 1000 Lumen USB Rechargeable Flashlight, 18650 Rechargeable Li-ion Battery, USB Charging Cable and Holster with 2 X EdisonBright CR123A Lithium Batteries",4.0,133.08,,Tools & Home Improvement,B00T922CFQ,,,https://images-na.ssl-images-amazon.com/images/I/71GiY5K7EML._AC_SX425_.jpg
95,R31ENW0LG0UO4A,True,Four Stars,Very good light. Wish it had an end cap on/off switch,the united states,"February 10, 2017",Amazon Customer,4.0,0,2020-11-12 15:19:49.235290,2020-11-12 15:19:49.445586,"Nitecore MH10 CREE XM-L2 U2 LED 1000 Lumen USB Rechargeable Flashlight, 18650 Rechargeable Li-ion Battery, USB Charging Cable and Holster with 2 X EdisonBright CR123A Lithium Batteries",4.0,133.08,,Tools & Home Improvement,B00T922CFQ,,,https://images-na.ssl-images-amazon.com/images/I/71GiY5K7EML._AC_SX425_.jpg
96,R3VRUZ1YACR4VM,True,Five Stars,Love it,the united states,"July 2, 2017",kendon,5.0,0,2020-11-12 15:19:49.451942,2020-11-12 15:19:49.666239,"Nitecore MH10 CREE XM-L2 U2 LED 1000 Lumen USB Rechargeable Flashlight, 18650 Rechargeable Li-ion Battery, USB Charging Cable and Holster with 2 X EdisonBright CR123A Lithium Batteries",4.0,133.08,,Tools & Home Improvement,B00T922CFQ,,,https://images-na.ssl-images-amazon.com/images/I/71GiY5K7EML._AC_SX425_.jpg
97,RV5UQTO26XQCK,True,Five Stars,very nice headlamp,the united states,"February 3, 2016",Amazon Customer,5.0,0,2020-11-12 15:19:49.672877,2020-11-12 15:19:49.944265,"Nitecore MH10 CREE XM-L2 U2 LED 1000 Lumen USB Rechargeable Flashlight, 18650 Rechargeable Li-ion Battery, USB Charging Cable and Holster with 2 X EdisonBright CR123A Lithium Batteries",4.0,133.08,,Tools & Home Improvement,B00T922CFQ,,,https://images-na.ssl-images-amazon.com/images/I/71GiY5K7EML._AC_SX425_.jpg
98,R23PBV48W2IK5I,True,Five Stars,Best light I've ever owned! Worth the money!!,the united states,"January 3, 2016",Chasity,5.0,0,2020-11-12 15:19:49.951933,2020-11-12 15:19:50.190006,"Nitecore MH10 CREE XM-L2 U2 LED 1000 Lumen USB Rechargeable Flashlight, 18650 Rechargeable Li-ion Battery, USB Charging Cable and Holster with 2 X EdisonBright CR123A Lithium Batteries",4.0,133.08,,Tools & Home Improvement,B00T922CFQ,,,https://images-na.ssl-images-amazon.com/images/I/71GiY5K7EML._AC_SX425_.jpg
99,R39MLMQKDU83SB,True,Three Stars,I don't like the button on the side. It should be on the end.,the united states,"August 27, 2016",Kerry G.,3.0,0,2020-11-12 15:19:50.203155,2020-11-12 15:19:50.448406,"Nitecore MH10 CREE XM-L2 U2 LED 1000 Lumen USB Rechargeable Flashlight, 18650 Rechargeable Li-ion Battery, USB Charging Cable and Holster with 2 X EdisonBright CR123A Lithium Batteries",4.0,133.08,,Tools & Home Improvement,B00T922CFQ,,,https://images-na.ssl-images-amazon.com/images/I/71GiY5K7EML._AC_SX425_.jpg
100,R3V4HAFSWXEBY3,True,Five Stars,Great flashlight Compact and very bright long lasting light,the united states,"November 1, 2016",Super Trucker,5.0,0,2020-11-12 15:19:53.711332,2020-11-12 15:19:53.892235,"Nitecore MH10 CREE XM-L2 U2 LED 1000 Lumen USB Rechargeable Flashlight, 18650 Rechargeable Li-ion Battery, USB Charging Cable and Holster with 2 X EdisonBright CR123A Lithium Batteries",4.0,133.08,,Tools & Home Improvement,B00T922CFQ,,,https://images-na.ssl-images-amazon.com/images/I/71GiY5K7EML._AC_SX425_.jpg
101,R1XTCJONPUKXMU,True,"Good quality, bad button placement.","Seems to be high quality. Like the features it has except the button position. I'm use to lights with button on the end. Don't care for the side button. For a little light it is really bright. Took a minute to figure how to change brightness but now it seems easy. Like the strobe pattern, really fast. All in all it is a good light though.",the united states,"October 21, 2015",C. L.,4.0,0,2020-11-12 15:19:53.897338,2020-11-12 15:19:54.047070,"Nitecore MH10 CREE XM-L2 U2 LED 1000 Lumen USB Rechargeable Flashlight, 18650 Rechargeable Li-ion Battery, USB Charging Cable and Holster with 2 X EdisonBright CR123A Lithium Batteries",4.0,133.08,,Tools & Home Improvement,B00T922CFQ,,,https://images-na.ssl-images-amazon.com/images/I/71GiY5K7EML._AC_SX425_.jpg
