,author_id,verified_purchase,review_title,reviews,country,date,reviewer_name,ratings,people_find_helpful,start_time,end_time,product_name,average_rating,price,total_reviews,product_category,product_id,meta_data,rank,product_image_url
102,R3QK066Q7GO6XZ,True,Five Stars,great,the united states,"March 7, 2016",AM HANIVHCHOR,5.0,0,2020-11-12 15:19:54.053196,2020-11-12 15:19:54.197637,"Nitecore MH10 CREE XM-L2 U2 LED 1000 Lumen USB Rechargeable Flashlight, 18650 Rechargeable Li-ion Battery, USB Charging Cable and Holster with 2 X EdisonBright CR123A Lithium Batteries",4.0,133.08,,Tools & Home Improvement,B00T922CFQ,,,https://images-na.ssl-images-amazon.com/images/I/71GiY5K7EML._AC_SX425_.jpg
103,R11F7LY26E6TBI,True,Four Stars,"Great flashlight, just wish it had the tail button.",the united states,"September 30, 2016",Bryn G.,4.0,0,2020-11-12 15:19:54.203291,2020-11-12 15:19:54.362331,"Nitecore MH10 CREE XM-L2 U2 LED 1000 Lumen USB Rechargeable Flashlight, 18650 Rechargeable Li-ion Battery, USB Charging Cable and Holster with 2 X EdisonBright CR123A Lithium Batteries",4.0,133.08,,Tools & Home Improvement,B00T922CFQ,,,https://images-na.ssl-images-amazon.com/images/I/71GiY5K7EML._AC_SX425_.jpg
104,R3PDQ29KYAVJEY,True,Five Stars,Great light,the united states,"June 14, 2016",Amazon Customer,5.0,0,2020-11-12 15:19:54.367696,2020-11-12 15:19:54.510507,"Nitecore MH10 CREE XM-L2 U2 LED 1000 Lumen USB Rechargeable Flashlight, 18650 Rechargeable Li-ion Battery, USB Charging Cable and Holster with 2 X EdisonBright CR123A Lithium Batteries",4.0,133.08,,Tools & Home Improvement,B00T922CFQ,,,https://images-na.ssl-images-amazon.com/images/I/71GiY5K7EML._AC_SX425_.jpg
105,R2PQ8H2KOZXXN1,True,The flashlight is very bright. I bought it to ...,The flashlight is very bright. I bought it to light up my yard when I'm out at night with my dogs. The on/off switch is a pain. Frequently I'd be trying to turn off the light by hitting the USB cover. The most disappointing thing is that the rechargeable battery would not hold a charge after the first week. The two regular and new back up batteries were dead when I put them n the flashlight. For the amount of money they charge I want it to work at least through the warrantee.,the united states,"April 15, 2016",Bibi,2.0,0,2020-11-12 15:19:54.516750,2020-11-12 15:19:54.673349,"Nitecore MH10 CREE XM-L2 U2 LED 1000 Lumen USB Rechargeable Flashlight, 18650 Rechargeable Li-ion Battery, USB Charging Cable and Holster with 2 X EdisonBright CR123A Lithium Batteries",4.0,133.08,,Tools & Home Improvement,B00T922CFQ,,,https://images-na.ssl-images-amazon.com/images/I/71GiY5K7EML._AC_SX425_.jpg
106,R2Q0ZCQGMT3MUI,True,So-so,The size and weight of the flashlight is great. The brightness is adequate. The on off button is terrible. It's too small and hard to locate quickly in an emergency situation. Not great for law enforcement. A larger on button or relocating it to the rear of the flashlight would make it a superior product.,the united states,"February 29, 2016",vincent alonzo,3.0,0,2020-11-12 15:19:54.679024,2020-11-12 15:19:54.848825,"Nitecore MH10 CREE XM-L2 U2 LED 1000 Lumen USB Rechargeable Flashlight, 18650 Rechargeable Li-ion Battery, USB Charging Cable and Holster with 2 X EdisonBright CR123A Lithium Batteries",4.0,133.08,,Tools & Home Improvement,B00T922CFQ,,,https://images-na.ssl-images-amazon.com/images/I/71GiY5K7EML._AC_SX425_.jpg
107,R1A5X44V0GWD6,True,Dim,I would have rated it lower if I could. This light was not as bright as my coast with 325 lumens. Maybe I just got a dud but for the amount of the money that you pay for it I would think it would be so much better.1000 lumens... NOT,the united states,"September 13, 2016",Lisa Chandler,1.0,0,2020-11-12 15:19:54.858841,2020-11-12 15:19:55.062525,"Nitecore MH10 CREE XM-L2 U2 LED 1000 Lumen USB Rechargeable Flashlight, 18650 Rechargeable Li-ion Battery, USB Charging Cable and Holster with 2 X EdisonBright CR123A Lithium Batteries",4.0,133.08,,Tools & Home Improvement,B00T922CFQ,,,https://images-na.ssl-images-amazon.com/images/I/71GiY5K7EML._AC_SX425_.jpg
108,RTYU7NMHITEC6,True,Left in the dark!!,This produced works for about a week before it decided no to keep a charge and opted not to turn on again even with removing the chargeable battery and replacing them with the other sets still the same issue existed,the united states,"November 15, 2016",i_am_legend,1.0,0,2020-11-12 15:19:55.068232,2020-11-12 15:19:55.228223,"Nitecore MH10 CREE XM-L2 U2 LED 1000 Lumen USB Rechargeable Flashlight, 18650 Rechargeable Li-ion Battery, USB Charging Cable and Holster with 2 X EdisonBright CR123A Lithium Batteries",4.0,133.08,,Tools & Home Improvement,B00T922CFQ,,,https://images-na.ssl-images-amazon.com/images/I/71GiY5K7EML._AC_SX425_.jpg
109,R3PHDXQ7VLVKN2,True,Five Stars,Awesome,the united states,"May 26, 2015",fernando romero,5.0,0,2020-11-12 15:19:55.242939,2020-11-12 15:19:55.409050,"Nitecore MH10 CREE XM-L2 U2 LED 1000 Lumen USB Rechargeable Flashlight, 18650 Rechargeable Li-ion Battery, USB Charging Cable and Holster with 2 X EdisonBright CR123A Lithium Batteries",4.0,133.08,,Tools & Home Improvement,B00T922CFQ,,,https://images-na.ssl-images-amazon.com/images/I/71GiY5K7EML._AC_SX425_.jpg
110,R157PLK94I7W1T,True,Great light,"It's a great light. The only two problems that I have is: 1.) When it is in the holster, it turns on somehow and causes the battery to drain and/or it starts burning the holster. 2.) The flap that protects the charger area does not like to stay closed.",the united states,"October 12, 2015",burn32,4.0,0,2020-11-12 15:20:00.537872,2020-11-12 15:20:00.777179,"Nitecore MH10 CREE XM-L2 U2 LED 1000 Lumen USB Rechargeable Flashlight, 18650 Rechargeable Li-ion Battery, USB Charging Cable and Holster with 2 X EdisonBright CR123A Lithium Batteries",4.0,133.08,,Tools & Home Improvement,B00T922CFQ,,,https://images-na.ssl-images-amazon.com/images/I/71GiY5K7EML._AC_SX425_.jpg
111,R2BXQXCWZOKY2G,True,bright but doesn't stay charged long,This flashlight gets real warm in your hand. It is bright but not for long. This isn't one that you would want to use for an extended period but you couldn't anyway.,the united states,"February 19, 2016",Lucylou,3.0,0,2020-11-12 15:20:00.784803,2020-11-12 15:20:01.011513,"Nitecore MH10 CREE XM-L2 U2 LED 1000 Lumen USB Rechargeable Flashlight, 18650 Rechargeable Li-ion Battery, USB Charging Cable and Holster with 2 X EdisonBright CR123A Lithium Batteries",4.0,133.08,,Tools & Home Improvement,B00T922CFQ,,,https://images-na.ssl-images-amazon.com/images/I/71GiY5K7EML._AC_SX425_.jpg
112,R273BO1JVFLB01,True,I would not recommend this flashlight to anyone,I would not recommend this flashlight to anyone. It blew up in my hand. I was using the batteries that came with it. An hour later it started a box on fire in the office when the 2nd battery exploded!,the united states,"May 21, 2018",Morgan Justin sand,1.0,0,2020-11-12 15:20:01.019057,2020-11-12 15:20:01.251409,"Nitecore MH10 CREE XM-L2 U2 LED 1000 Lumen USB Rechargeable Flashlight, 18650 Rechargeable Li-ion Battery, USB Charging Cable and Holster with 2 X EdisonBright CR123A Lithium Batteries",4.0,133.08,,Tools & Home Improvement,B00T922CFQ,,,https://images-na.ssl-images-amazon.com/images/I/71GiY5K7EML._AC_SX425_.jpg
113,R19A12QPHQ2FMA,True,Five Stars,Great little light for duty work like the recharge ability via usb.,the united states,"March 29, 2015",Greg T Wingerter,5.0,0,2020-11-12 15:20:01.256675,2020-11-12 15:20:01.500331,"Nitecore MH10 CREE XM-L2 U2 LED 1000 Lumen USB Rechargeable Flashlight, 18650 Rechargeable Li-ion Battery, USB Charging Cable and Holster with 2 X EdisonBright CR123A Lithium Batteries",4.0,133.08,,Tools & Home Improvement,B00T922CFQ,,,https://images-na.ssl-images-amazon.com/images/I/71GiY5K7EML._AC_SX425_.jpg
114,R2Z4IMOD82OWM0,True,Would buy again just different model,Works great I accidentally dropped it off a ladder and it still works fine. The holster is nice and the clip works great. The down sides are the rear battery cap comes loose and i dont like the butten placement but thats mostly my fault. The cr123 batteries come almost dead but I've only charged it once in 3 weeks using the second brightest setting.,the united states,"March 21, 2017",don,4.0,0,2020-11-12 15:20:01.527923,2020-11-12 15:20:01.756036,"Nitecore MH10 CREE XM-L2 U2 LED 1000 Lumen USB Rechargeable Flashlight, 18650 Rechargeable Li-ion Battery, USB Charging Cable and Holster with 2 X EdisonBright CR123A Lithium Batteries",4.0,133.08,,Tools & Home Improvement,B00T922CFQ,,,https://images-na.ssl-images-amazon.com/images/I/71GiY5K7EML._AC_SX425_.jpg
115,R2PJEA6J17X9MP,True,Off grid FTW,"Great light. Allows for multi settings and has a USB charge port, making it convenient and perfect for solar panel charging.",the united states,"January 10, 2016",BJ L,5.0,0,2020-11-12 15:20:01.764203,2020-11-12 15:20:01.984744,"Nitecore MH10 CREE XM-L2 U2 LED 1000 Lumen USB Rechargeable Flashlight, 18650 Rechargeable Li-ion Battery, USB Charging Cable and Holster with 2 X EdisonBright CR123A Lithium Batteries",4.0,133.08,,Tools & Home Improvement,B00T922CFQ,,,https://images-na.ssl-images-amazon.com/images/I/71GiY5K7EML._AC_SX425_.jpg
116,REF38FDQGPPT5,True,Amazing flashlight!,It makes you blind and burns your skin if you hold it close ! Amazing flashlight !,the united states,"April 3, 2015",Theo.G,5.0,0,2020-11-12 15:20:01.984744,2020-11-12 15:20:02.223315,"Nitecore MH10 CREE XM-L2 U2 LED 1000 Lumen USB Rechargeable Flashlight, 18650 Rechargeable Li-ion Battery, USB Charging Cable and Holster with 2 X EdisonBright CR123A Lithium Batteries",4.0,133.08,,Tools & Home Improvement,B00T922CFQ,,,https://images-na.ssl-images-amazon.com/images/I/71GiY5K7EML._AC_SX425_.jpg
117,R1A6UIFUMSRRAU,True,Two Stars,Good light wish there was more function to it.light goes on for no reason!!,the united states,"February 27, 2016",Monju,2.0,0,2020-11-12 15:20:02.235770,2020-11-12 15:20:02.510403,"Nitecore MH10 CREE XM-L2 U2 LED 1000 Lumen USB Rechargeable Flashlight, 18650 Rechargeable Li-ion Battery, USB Charging Cable and Holster with 2 X EdisonBright CR123A Lithium Batteries",4.0,133.08,,Tools & Home Improvement,B00T922CFQ,,,https://images-na.ssl-images-amazon.com/images/I/71GiY5K7EML._AC_SX425_.jpg
118,R1D6DY92ZXJZAP,True,About the best light you can get if you're probation/parole officer,"Perfect Flashlight for probation/parole officers. Slim, fits well on the belt. positives: 1)easy to use. Just press the button and it goes from low, medium to high beam, double click and you get strobe. Just that easy. 2)Rechargeable. You can use regular batteries, but the rechargeable works great. Another great bonus is the charger is the same for my work phone and my kindle. You can charge at home or in the car while doing home visits. 3) build. solid construction, not cheap feeling at all. Definitely built to last. Negatives 1)cost. its not as expensive as many, but still not cheap 2)the charge slot is opposite side of the power button, and can be easily confused. otherwise, no complaints. love it,and use it daily.",the united states,"July 12, 2015",Donald Plumley,5.0,0,2020-11-12 15:20:02.519045,2020-11-12 15:20:02.752323,"Nitecore MH10 CREE XM-L2 U2 LED 1000 Lumen USB Rechargeable Flashlight, 18650 Rechargeable Li-ion Battery, USB Charging Cable and Holster with 2 X EdisonBright CR123A Lithium Batteries",4.0,133.08,,Tools & Home Improvement,B00T922CFQ,,,https://images-na.ssl-images-amazon.com/images/I/71GiY5K7EML._AC_SX425_.jpg
119,R1VA57M8QVW3QV,True,LOVE THE,BOUGHT SOME FOR MY EMPLOYEES. LOVE THE FLASHLIGHT,the united states,"October 13, 2015",rich gastrich,5.0,0,2020-11-12 15:20:02.759733,2020-11-12 15:20:02.998201,"Nitecore MH10 CREE XM-L2 U2 LED 1000 Lumen USB Rechargeable Flashlight, 18650 Rechargeable Li-ion Battery, USB Charging Cable and Holster with 2 X EdisonBright CR123A Lithium Batteries",4.0,133.08,,Tools & Home Improvement,B00T922CFQ,,,https://images-na.ssl-images-amazon.com/images/I/71GiY5K7EML._AC_SX425_.jpg
120,R326ZQE0XBFZPX,True,Switch Malfunctioned days after the return policy expired,Haven't had the product for two months and the off/on switch will not work. I work a split shift beginning in the evenings and I went to use my light around 2100 hours and it failed. Thank God I was carrying my 511 ATAC as I am normally equipped with a spare or back-up even my TLR-S attached to my Glock 21 Gen 4. Can never have too many lights in my field. Checked and/or replaced the batteries and those batteries functioned and provided power to my other flashlights. Cannot return this item because the 30 day return policy has expired and the switch malfunctioned just after 30 days.,the united states,"October 21, 2015",Ghostfaace,1.0,0,2020-11-12 15:20:09.177150,2020-11-12 15:20:09.413114,"Nitecore MH10 CREE XM-L2 U2 LED 1000 Lumen USB Rechargeable Flashlight, 18650 Rechargeable Li-ion Battery, USB Charging Cable and Holster with 2 X EdisonBright CR123A Lithium Batteries",4.0,133.08,,Tools & Home Improvement,B00T922CFQ,,,https://images-na.ssl-images-amazon.com/images/I/71GiY5K7EML._AC_SX425_.jpg
121,R21SIGXL3ZZIPY,True,"Cute,but no static mode as it states it has","Cute, but does not have a static mode like it says it does. I really wanted a static mode where it just looks like stars on the house. These lights are always moving. Can't decide if I'm going to return it or not. It's still cute, but doesn't light up with as many static lights as some of the pictures show that it does....",the united states,"December 24, 2015",Paula McDonald,3.0,0,2020-11-12 15:20:09.423022,2020-11-12 15:20:09.644989,"Nitecore MH10 CREE XM-L2 U2 LED 1000 Lumen USB Rechargeable Flashlight, 18650 Rechargeable Li-ion Battery, USB Charging Cable and Holster with 2 X EdisonBright CR123A Lithium Batteries",4.0,133.08,,Tools & Home Improvement,B00T922CFQ,,,https://images-na.ssl-images-amazon.com/images/I/71GiY5K7EML._AC_SX425_.jpg
122,R5TXD7GE7AVS3,True,Five Stars,I love it,the united states,"August 27, 2016",Chinh Trinh,5.0,0,2020-11-12 15:20:09.651962,2020-11-12 15:20:09.812105,"Nitecore MH10 CREE XM-L2 U2 LED 1000 Lumen USB Rechargeable Flashlight, 18650 Rechargeable Li-ion Battery, USB Charging Cable and Holster with 2 X EdisonBright CR123A Lithium Batteries",4.0,133.08,,Tools & Home Improvement,B00T922CFQ,,,https://images-na.ssl-images-amazon.com/images/I/71GiY5K7EML._AC_SX425_.jpg
123,R3FEEONC6SW7PG,True,Five Stars,Great flashlight,the united states,"September 5, 2016",Mike Piazza,5.0,0,2020-11-12 15:20:09.821779,2020-11-12 15:20:10.050650,"Nitecore MH10 CREE XM-L2 U2 LED 1000 Lumen USB Rechargeable Flashlight, 18650 Rechargeable Li-ion Battery, USB Charging Cable and Holster with 2 X EdisonBright CR123A Lithium Batteries",4.0,133.08,,Tools & Home Improvement,B00T922CFQ,,,https://images-na.ssl-images-amazon.com/images/I/71GiY5K7EML._AC_SX425_.jpg
124,RNK6HUS2Q3KHK,True,Too little for too much money,"For a very expensive flashlight too many flaws. USB port is shallow and bent. The cover for the mini USB port does not stay on,it is on the exact opposite side of the on off switch in the dark you cannot tell which one is which. High medium and low was too complicated to figure out I would not buy this flashlight again.Now the USB port does not work at all,out all that money and I""m pissed off !!!!!!!!",the united states,"April 3, 2015",Slg342,1.0,0,2020-11-12 15:20:10.056195,2020-11-12 15:20:10.222547,"Nitecore MH10 CREE XM-L2 U2 LED 1000 Lumen USB Rechargeable Flashlight, 18650 Rechargeable Li-ion Battery, USB Charging Cable and Holster with 2 X EdisonBright CR123A Lithium Batteries",4.0,133.08,,Tools & Home Improvement,B00T922CFQ,,,https://images-na.ssl-images-amazon.com/images/I/71GiY5K7EML._AC_SX425_.jpg
125,R112VQRNDGDY4G,True,Awesome rechargeable light that packs a punch!,Compact 1000 lumen rechargeable. Awesome light. Rechargeable battery included. Low cost operation with USB charging. All set.,the united states,"February 12, 2015",eWiz,5.0,0,2020-11-12 15:20:10.229587,2020-11-12 15:20:10.383458,"Nitecore MH10 CREE XM-L2 U2 LED 1000 Lumen USB Rechargeable Flashlight, 18650 Rechargeable Li-ion Battery, USB Charging Cable and Holster with 2 X EdisonBright CR123A Lithium Batteries",4.0,133.08,,Tools & Home Improvement,B00T922CFQ,,,https://images-na.ssl-images-amazon.com/images/I/71GiY5K7EML._AC_SX425_.jpg
126,R7JQ16Q2CPPV,True,Side button design is for light sabers not flashlights!,What a crappy position to put the on off button on the side..wtf engineer came up with that dumb idea? This button position turned an awesome light into a truly bad design. Rant over...the rest of the light was crafted really well and in a small form factor to boot. The usb charging was a novel idea and can be charged just about any where. If you use your light a lot like me then the buttons a deal breaker...don't do it!,the united states,"July 3, 2015",Im a tool,2.0,0,2020-11-12 15:20:10.390351,2020-11-12 15:20:10.551283,"Nitecore MH10 CREE XM-L2 U2 LED 1000 Lumen USB Rechargeable Flashlight, 18650 Rechargeable Li-ion Battery, USB Charging Cable and Holster with 2 X EdisonBright CR123A Lithium Batteries",4.0,133.08,,Tools & Home Improvement,B00T922CFQ,,,https://images-na.ssl-images-amazon.com/images/I/71GiY5K7EML._AC_SX425_.jpg
127,R1SVGS9S55LYI5,True,Two Stars,"Unfortunately, there is no battery when I got the package so I have to buy it separately.",the united states,"January 19, 2016",Angelito Tebelin,2.0,0,2020-11-12 15:20:10.557212,2020-11-12 15:20:10.707878,"Nitecore MH10 CREE XM-L2 U2 LED 1000 Lumen USB Rechargeable Flashlight, 18650 Rechargeable Li-ion Battery, USB Charging Cable and Holster with 2 X EdisonBright CR123A Lithium Batteries",4.0,133.08,,Tools & Home Improvement,B00T922CFQ,,,https://images-na.ssl-images-amazon.com/images/I/71GiY5K7EML._AC_SX425_.jpg
